text,afraid,angry,anxious,calm,confused,disgusted,excited,frustrated,happy,proud,sad,satisfied,surprised,topic
i do not have some inspired thought to completely override this feeling of being utterly overwhelmed but i will say that i am too driven by a sense of purpose to sit idly by and just accept our education system as it is,0,0,0,0,0,0,0,0,0,0,0,0,1,school
i feel like the jolly will be a pastiche of my experiences in nyc seattle and co mixed up with its own special flavor,0,0,0,0,0,0,0,0,1,0,0,0,0,recreation
i have hours of free time spent sleeping and feeling overwhelmed,0,0,0,0,0,0,0,0,0,0,0,0,1,sleep
i know how to lose all your friends and feel terrible about yourself,0,0,0,0,0,0,0,0,0,0,1,0,0,friends
i awoke this morning thinking that i should tell my mum how i feel about the fact that she ignored me and continued to do what she wanted to get something me that she wanted,0,0,0,0,0,0,0,0,0,0,1,0,0,family
i feel like i must be fine now and ready to go home having gone from constant panic about my health and hour support to bugger all almost over night,0,0,0,0,0,0,0,0,1,0,0,0,0,health
i was making lunch eden was feeling impatient so she pulled out a bag of cereal and held it up to me,0,1,0,0,0,0,0,0,0,0,0,0,0,food
i also apply for food stamps which makes the feelings of unworthiness and useless much worse,0,0,0,0,0,0,0,0,0,0,1,0,0,food
im sick hurt or feeling lousy i can almost guarantee i will get a call from her,0,0,0,0,0,0,0,0,0,0,1,0,0,health
i feel like a sleep deprived interrogant and what do you call a person under interrogation anyway,0,0,0,0,0,0,0,0,0,0,1,0,0,sleep
ive always liked hummus but now that it got lcs stamp of approval i just feel more glamourous and exciting eating it,0,0,0,0,0,0,0,0,1,0,0,0,0,food
i also had an argument with my parents and it feels rather unpleasant to be stuck at home at the moment,0,0,0,0,0,0,0,0,0,0,1,0,0,family
i am feeling frustrated because i don t want to eat your corned beef for dinner,0,1,0,0,0,0,0,0,0,0,0,0,0,food
im sitting here at work feeling completely devastated and defeated and im certain its the devil stealing my joy from my a href http www,0,0,0,0,0,0,0,0,0,0,1,0,0,work
i suppose lately i just feel extremely appreciative of the friends i have because id be pretty fucked at the moment without them,0,0,0,0,0,0,0,0,1,0,0,0,0,friends
i feel that i don t reach the deeper stages of sleep which they say are vital to a good sleep and proper functioning the following day,0,0,0,0,0,0,0,0,1,0,0,0,0,sleep
i feel as it is imprinted in my brain by now how vital stress in the college community,0,0,0,0,0,0,0,0,1,0,0,0,0,school
i see someone walking a dog i feel envious of them,0,1,0,0,0,0,0,0,0,0,0,0,0,exercise
i missed my friends my job and feeling productive,0,0,0,0,0,0,0,0,1,0,0,0,0,friends
i love it when i am in a great mood and feeling peaceful i ve been feeling pretty content for at least a week now and i m pretty happy about it,0,0,0,0,0,0,0,0,1,0,0,0,0,love
i am feeling somewhat disillusioned with said buddy perhaps this is not all bad,0,0,0,0,0,0,0,0,0,0,1,0,0,friends
im not looking forward to my one on one because one its saturday and two im not feeling well,0,0,0,0,0,0,0,0,1,0,0,0,0,health
i feel like its a lot more acceptable lately to say im just not eating sugar right now,0,0,0,0,0,0,0,0,1,0,0,0,0,food
i didn t want her to feel badly or seem an ungrateful guest so i mowed down on the meal she made,0,0,0,0,0,0,0,0,0,0,1,0,0,food
i will apparently feel joyful and peaceful and there will be wonder and love at christmas,0,0,0,0,0,0,0,0,1,0,0,0,0,love
i have been avoiding talking about the counselor with is how i feel i was sexually assaulted when i was in college,1,0,0,0,0,0,0,0,0,0,0,0,0,school
i have a feeling that im going to spending more of my valuable free at the grocery store,0,0,0,0,0,0,0,0,1,0,0,0,0,food
i feel resigned to the fact that i will be the maiden aunt,0,0,0,0,0,0,0,0,0,0,1,0,0,family
i love most and some of them i feel disgusted of some friends i hope i could be with them thru the next years and some i really hope not to,0,1,0,0,0,0,0,0,0,0,0,0,0,friends
i feel so bitchy dude i need sleep,0,1,0,0,0,0,0,0,0,0,0,0,0,sleep
i feel so unimportant to my friends and people around me,0,0,0,0,0,0,0,0,0,0,1,0,0,friends
i feel shy to say that i signed up for the mdi marathon in october but i do not feel shy to say that it has me running every day,1,0,0,0,0,0,0,0,0,0,0,0,0,exercise
i was feeling rich a bowl of their homemade apple sauce was really good poured over the wazanki,0,0,0,0,0,0,0,0,1,0,0,0,0,food
i had just been complaining to my best friend that i was feeling deprived during the week because due to distance and schedules j,0,0,0,0,0,0,0,0,0,0,1,0,0,friends
i had some sleep and i am feeling more like myself i am convinced that it is the hormones or lack of them,0,0,0,0,0,0,0,0,1,0,0,0,0,sleep
i pray for perseverance through sibling fights hurt feelings and angry retorts,0,1,0,0,0,0,0,0,0,0,0,0,0,family
i can call my best friend when i want to feel accepted,0,0,0,0,0,0,0,0,1,0,0,0,0,friends
i am feeling a bit paranoid about only having all this work in a notebook,1,0,0,0,0,0,0,0,0,0,0,0,0,work
i look at my friends in other sch cca and i just feel damn jealous of them,0,1,0,0,0,0,0,0,0,0,0,0,0,friends
i go back to bed and toss and turn for a little bit before finally going to sleep around and then getting up feeling groggy around,0,0,0,0,0,0,0,0,0,0,1,0,0,sleep
i just had had an argument with a friend and chickened out of getting a nose piercing and didn t feel like being bothered but i definitely needed a cocktail,0,1,0,0,0,0,0,0,0,0,0,0,0,friends
i feel emotional only towards my best friend and the girl i love not my girlfriend she doesn t feel the same way,0,0,0,0,0,0,0,0,0,0,1,0,0,friends
i was starting to feel a bit lethargic i knew instinctively to text my dad,0,0,0,0,0,0,0,0,0,0,1,0,0,family
i can feel that my labors are in vain when i give all that i can to minister to counsel disciple someone and that person turns around and acts as if i never said or did anything,0,0,0,0,0,0,0,0,0,0,1,0,0,work
i can sleep this feeling away and not have it look suspicious,1,0,0,0,0,0,0,0,0,0,0,0,0,sleep
i think it is so awesome that i can believe in my church and have the freedom to believe and practice how i feel its another form of love that i feel i am so privileged to have a choice in,0,0,0,0,0,0,0,0,1,0,0,0,0,love
im also struggling with feeling resentful at work with every new project feeling like an imposition,0,1,0,0,0,0,0,0,0,0,0,0,0,work
i called in sick today because i have had no sleep and i feel rotten to the core,0,0,0,0,0,0,0,0,0,0,1,0,0,sleep
i was delighted to join them in marriage and loved feeling that self assured kind of love radiating between them,0,0,0,0,0,0,0,0,1,0,0,0,0,love
i eat it i feel so amazed i can hardly believe its really bread,0,0,0,0,0,0,0,0,0,0,0,0,1,food
i am feeling rather blessed that i have the chance to be able to do something i love in my life,0,0,0,0,0,0,0,0,1,0,0,0,0,love
im feeling apprehensive irritated or distressed im usually meditating on everything but god,1,0,0,0,0,0,0,0,0,0,0,0,0,god
i kind of feel like the couple friends i have there arent very keen on seeing me except sarah shes the exception without a doubt who will be glad to see me,0,0,0,0,0,0,0,0,1,0,0,0,0,friends
i hit my hubby today as the anger was in my veins making me feel restless shout and be offensive to him and my baby and i feel really bad about it,1,0,0,0,0,0,0,0,0,0,0,0,0,family
i wake up feeling apprehensive about the miler i am meant to be running,1,0,0,0,0,0,0,0,0,0,0,0,0,exercise
i do in school the less talented i feel i ve always struggled with confidence in my abilities but i feel less and less talented because i m scared i m reaching the top of my talent,0,0,0,0,0,0,0,0,1,0,0,0,0,school
ive always understood this phrase we feel worthless so we accept worthless love we feel like the center of the universe so we accept the universes love etc,0,0,0,0,0,0,0,0,0,0,1,0,0,love
i dont want to go to bed at night because i know i will wake up feeling depressed or anxious,0,0,0,0,0,0,0,0,0,0,1,0,0,sleep
i like the fact that i feel like im somehow supporting greece by making this dessert which seems needed in those trouble times theyre having,0,0,0,0,0,0,0,0,1,0,0,0,0,food
im going to go back to bed as i feel rotten,0,0,0,0,0,0,0,0,0,0,1,0,0,sleep
i would go out to coffee and have hours long conversations with my friends about these things and i would leave feeling richer for it and less disturbed than when i went in,0,0,0,0,0,0,0,0,0,0,1,0,0,friends
i mean he didn t even have a place to sleep so it makes me feel greedy when i get upset over stupid things because i have it so good,0,1,0,0,0,0,0,0,0,0,0,0,0,sleep
i feel that you have ignored the fact that the majority of wedding professionals are hard working honest business people trying to make an honest living while making their customers engaged couples happy,0,0,0,0,0,0,0,0,0,0,1,0,0,work
i have a sick feeling i should be smart enough to overcome,0,0,0,0,0,0,0,0,1,0,0,0,0,health
i really do need her help since most of the time i was feeling groggy because of lack of sleep,0,0,0,0,0,0,0,0,0,0,1,0,0,sleep
when i got to know that my father had passed away,0,0,0,0,0,0,0,0,0,0,1,0,0,family
im tired on friday because i am at work again and feeling a bit drained,0,0,0,0,0,0,0,0,0,0,1,0,0,work
i have huge expectations from my close set of friends which i feel are not bothered about,0,1,0,0,0,0,0,0,0,0,0,0,0,friends
i do i really wanna do a good one and just have fun and not want my friends to feel weird and awkward,1,0,0,0,0,0,0,0,0,0,0,0,0,friends
i was feeling shy at first as we entered their home since well be staying in a house owned by a strange family but then again its a new experience,1,0,0,0,0,0,0,0,0,0,0,0,0,family
i was forever feeling jealous of everything my sister had and i was jealous of this,0,1,0,0,0,0,0,0,0,0,0,0,0,family
im feeling rebellious i feel like causing a stir in my comm class,0,1,0,0,0,0,0,0,0,0,0,0,0,school
i am just reading about your mom always being sad and it s funny because i just got off the phone with my mom and brother who also often leave me feeling distressed for them,1,0,0,0,0,0,0,0,0,0,0,0,0,family
i were harper lee i might after all these years have a sinking feeling every time i glimpsed yet another stack of popular library paperbacks on the back shelf of a schoolroom,0,0,0,0,0,0,0,0,1,0,0,0,0,school
ive slept hours nightly and still feel listless,0,0,0,0,0,0,0,0,0,0,1,0,0,sleep
i need all these items in my closet its that i genuinely need them in my life to feel fully satisfied like the feeling you get after polishing off a large meal or a sneaky chocolate brownie you definitely probably shouldnt have had,0,0,0,0,0,0,0,0,1,0,0,0,0,food
i feel unloved i am grateful for people who no matter what set me straight and love me anyway,0,0,0,0,0,0,0,0,0,0,1,0,0,love
i have been feeling really envious of family members who have help like that,0,1,0,0,0,0,0,0,0,0,0,0,0,family
i would feel unhappy or depressed my mum would be the one who would lift my spirits and tell me that i wasnt fat or ugly or uselss,0,0,0,0,0,0,0,0,0,0,1,0,0,family
i always sneak a quick lick of the chocolate frosting even before it covers the cake feeling cool and delicate on my finger,0,0,0,0,0,0,0,0,1,0,0,0,0,food
when my mother rejected my boyfriend and made unfair judgements on him,0,1,0,0,0,0,0,0,0,0,0,0,0,family
i turned to god feeling a little dumb for not going to him for answers at the start,0,0,0,0,0,0,0,0,0,0,1,0,0,god
i love feeling empty after that huge mistake,0,0,0,0,0,0,0,0,0,0,1,0,0,love
i always find on a road trip i feel miserable because of the food i eat usually purchased at whatever stop we make,0,0,0,0,0,0,0,0,0,0,1,0,0,food
i call her half as often as i did when i was at school and had a lot to do now i feel like im being needy because i actually dont have anything else to do,0,0,0,0,0,0,0,0,0,0,1,0,0,school
i feel like ive totally lost control over my life house kids,0,0,0,0,0,0,0,0,0,0,1,0,0,family
ive stayed up this long my last all nighter hours without sleep in mid december im not really feeling too fucked up about it,0,1,0,0,0,0,0,0,0,0,0,0,0,sleep
i love to read all your comments so please feel free to post,0,0,0,0,0,0,0,0,1,0,0,0,0,love
i treat friends like i ve never met them some days and i feel scared to talk to people who claim that they like me,1,0,0,0,0,0,0,0,0,0,0,0,0,friends
i wasn t able to watch it last year and since i wanted to feel a bit more festive and happy i asked some of my good friends if they d like to join me in watching the show this time,0,0,0,0,0,0,0,0,1,0,0,0,0,friends
ive been not walking lately and just feeling a bit depressed about the whole thing i guess,0,0,0,0,0,0,0,0,0,0,1,0,0,exercise
im feeling obnoxious after work img alt src http,0,1,0,0,0,0,0,0,0,0,0,0,0,work
i called my sister later to ask her about something else i told her what mum and dad had said and she said she had noticed too she didnt feel alarmed thou she thought i knew i was doing it do i,1,0,0,0,0,0,0,0,0,0,0,0,0,family
i am eating a large berry sundae feeling that rich piercing mixture of pleasure and disappointment in myself familiar to those who struggle with diets and weight gain,0,0,0,0,0,0,0,0,1,0,0,0,0,food
i feel we have been very successful in establishing themes from other drama comedies and coming up with a unique selling point and storyline that we could carry forward for a full series,0,0,0,0,0,0,0,0,1,0,0,0,0,work
ive run out myself so feeling a little frantic,1,0,0,0,0,0,0,0,0,0,0,0,0,exercise
i feel like i could write a really long boring post all about friendships,0,0,0,0,0,0,0,0,0,0,1,0,0,friends
i have no doubt the site owners are feeling amazing every day when they check how much money they made on adsense while they were sleeping,0,0,0,0,0,0,0,0,0,0,0,0,1,sleep
i say i love it i truly do because i a wiser than this aspect amd recognise that the more i feel distracted or resistant about something the more powerful and life changing that event or connection will likely be,0,1,0,0,0,0,0,0,0,0,0,0,0,love
i felt fear when one night my aunt and uncle left me alone at their house to look after the baby when they went to a party,1,0,0,0,0,0,0,0,0,0,0,0,0,family
i do feel weird why seldom people eat at there,0,0,0,0,0,0,0,0,0,0,0,0,1,food
i feel quite stunned and embarrassed yet a tiny bit stronger after a typical conversation with the person i love loved dont was cut loose by,0,0,0,0,0,0,0,0,0,0,0,0,1,love
i not try again especially because i feel like having lame sex with manfriend is making me forget to have decent sex,0,0,0,0,0,0,0,0,0,0,1,0,0,friends
when my father banned me from going to his sisters home due to some misunderstanding between the two,0,1,0,0,0,0,0,0,0,0,0,0,0,family
i am fucking overjoyed man but its just the way that my family run makes me feel so troubled why is it so hard just to get a weeks break why do i need to feel so guilty,0,0,0,0,0,0,0,0,0,0,1,0,0,family
i left our lunch feeling vaguely disturbed which surprised me,0,0,0,0,0,0,0,0,0,0,1,0,0,food
i really felt about it and i hope that i can get this typre of feeling again if i am to get accepted to more colleges of my choice in the near future,0,0,0,0,0,0,0,0,1,0,0,0,0,school
i also think about it when i feel like writing rude things that pass through my head but since i have common sense realize would be disastrous to my ability to make and keep friends if published,0,1,0,0,0,0,0,0,0,0,0,0,0,friends
when my friend promised that she would come to my place,0,1,0,0,0,0,0,0,0,0,0,0,0,friends
i have so many people in my life that i love and that i feel the love from that i am lucky,0,0,0,0,0,0,0,0,1,0,0,0,0,love
i feel burdened with a weight that i cant describe when i want to sit down and mope when i want to stay in bed and wallow i choose instead to do the next thing,0,0,0,0,0,0,0,0,0,0,1,0,0,sleep
i now have the end in sight of work frustratingly im still not suddenly magically feeling physically amazing still very tired and sick a lot of the time,0,0,0,0,0,0,0,0,0,0,0,0,1,work
i feel that i am not smart enough to do this that i get into the classes that i need to i am currently wait listed for some direction and open doors for next fall and what to do next and for continued community with friends at apu and new friends at home,0,0,0,0,0,0,0,0,1,0,0,0,0,friends
i always leave nice families feeling optimistic,0,0,0,0,0,0,0,0,1,0,0,0,0,family
i feel such emotion about making sure i get things right i see my family before me,0,0,0,0,0,0,0,0,1,0,0,0,0,family
i often feel vaguely defective when i cant sleep,0,0,0,0,0,0,0,0,0,0,1,0,0,sleep
i already feel a special connection with my grandkids even though we have yet to meet,0,0,0,0,0,0,0,0,1,0,0,0,0,family
i am absolutely in love with my new shoes and i feel so smug that i got a pair of jeffrey campbell shoes for the same price a really nice pair would cost on the high street,0,0,0,0,0,0,0,0,1,0,0,0,0,love
i had been at work and just started to feel almost shaky,1,0,0,0,0,0,0,0,0,0,0,0,0,work
i eat in a day just made me feel awful,0,0,0,0,0,0,0,0,0,0,1,0,0,food
ive been feeling resentful lately and have not be working as hard as i usually do,0,1,0,0,0,0,0,0,0,0,0,0,0,work
i remember how desperate i used to feel i remember how jealous i was when my friends would tell me about their crushes boyfriends,0,1,0,0,0,0,0,0,0,0,0,0,0,friends
i went to bed feeling a little morose,0,0,0,0,0,0,0,0,0,0,1,0,0,sleep
i familiarized my custom surrendering of my work department i got to know most of my colleagues some very welcoming others feeling intimidated by my presence read i m a diaspora get me outta here to find out more but that s another story,1,0,0,0,0,0,0,0,0,0,0,0,0,work
the transport to pick us up for lunch was always late and the driver made the same excuse every day,0,1,0,0,0,0,0,0,0,0,0,0,0,food
i feel like the most popular girl in the world which is silly cause i was quite the opposite in school,0,0,0,0,0,0,0,0,1,0,0,0,0,school
i do this sometimes and then i check fb on my phone and it feels so ludicrous but still i do it like reaching for a drink when you know damn well youve had enough or another cookie or a chip,0,0,0,0,0,0,0,0,0,0,0,0,1,food
i have a recurring cancer scare that keeps coming back and right now i am not in a position to address it and that is another thing i feel helpless about,1,0,0,0,0,0,0,0,0,0,0,0,0,health
i say i m feeling all smug eating mangoes from our very own tree,0,0,0,0,0,0,0,0,1,0,0,0,0,food
i hope people or my friends wont feel irritated by my super organised or kiasu character,0,1,0,0,0,0,0,0,0,0,0,0,0,friends
i love you as in some western societies the chinese are more likely to express feelings of affection in a more casual way,0,0,0,0,0,0,0,0,1,0,0,0,0,love
i feel more energetic although thats all relative,0,0,0,0,0,0,0,0,1,0,0,0,0,family
i let myself fall asleep earlier this afternoon and i m feeling extremely shitty,0,0,0,0,0,0,0,0,0,0,1,0,0,sleep
i reach out trying to love but i feel nothing g yeah my heart is numb g am but with you em c i feel again g am yeah with you em c i can feel again yeah,0,0,0,0,0,0,0,0,0,0,1,0,0,love
i have been feeling as if god has been showing me some ugly ugly traits that i carry around,0,0,0,0,0,0,0,0,0,0,1,0,0,god
im feeling a little sleep deprived stressed overwhelmed and i think i might go crazy before this is all over,0,0,0,0,0,0,0,0,0,0,1,0,0,sleep
i was quite unhappy these past three days and i feel like a jerk for saying so because im just an ungrateful pain in the ass teenager who cant do anything nice for her own family without sulking about it,0,0,0,0,0,0,0,0,0,0,1,0,0,family
i am feeling a tad jaded this morning because i have not had much sleep,0,0,0,0,0,0,0,0,0,0,1,0,0,sleep
i feel especially threatened when it comes to my health,1,0,0,0,0,0,0,0,0,0,0,0,0,health
i got to do normal family activities and feel not so grumpy,0,1,0,0,0,0,0,0,0,0,0,0,0,family
i feel so humiliated that he told all his male friends and female friends that he left me,0,0,0,0,0,0,0,0,0,0,1,0,0,friends
i asked her about her health about her right eye and she never forget to cheer me up whenever i feel lost in the course,0,0,0,0,0,0,0,0,0,0,1,0,0,health
i feel i m still pissed about it to my failures of friends please don t because you don t see yourself the way that i see you please cheer up,0,1,0,0,0,0,0,0,0,0,0,0,0,friends
i wasnt feeling terrific still and i was getting fed up with it all,0,0,0,0,0,0,0,0,1,0,0,0,0,food
i feel agitated and frustrated and restrained by living in the city and working in an office,1,0,0,0,0,0,0,0,0,0,0,0,0,work
i didnt sleep well last night and i feel groggy and tired this morning not the best way to start the week,0,0,0,0,0,0,0,0,0,0,1,0,0,sleep
i feel i love trusting the flow i love just not thinking about aht,0,0,0,0,0,0,0,0,1,0,0,0,0,love
i am also feeling a little smug here as these coffee cup cakes fit rather nicely into two current blogging challenges,0,0,0,0,0,0,0,0,1,0,0,0,0,food
i still feel doomed from this flu thing but i cant afford to waste a day in bed at the mo,0,0,0,0,0,0,0,0,0,0,1,0,0,health
i am starting to feel very resentful towards other family members specifically my grandparents,0,1,0,0,0,0,0,0,0,0,0,0,0,family
i had a turkey burger with a side of pasta and am feeling pretty relaxed,0,0,0,0,0,0,0,0,1,0,0,0,0,food
i feel so exhausted i go on breakfast to burger king imagining that its safe in there and that almost certainly catholics loathe such places,0,0,0,0,0,0,0,0,0,0,1,0,0,food
i feel insecure sometime but every time she say love me i will melted instantly,1,0,0,0,0,0,0,0,0,0,0,0,0,love
i feel like ive annoyed another friend it upsets me so much,0,1,0,0,0,0,0,0,0,0,0,0,0,friends
i am humbled by all of these wonderful families at bloomsbury who keep making feel welcomed warmly in a place so far from home,0,0,0,0,0,0,0,0,1,0,0,0,0,family
i want attention or am feeling playful i will bug the shit of him until i get a reaction,0,0,0,0,0,0,0,0,1,0,0,0,0,recreation
i feel like i am in the lame duck session with school,0,0,0,0,0,0,0,0,0,0,1,0,0,school
i feel that it is a cool tool to use to gain the students attention but for some students it would only be useful in school because they do not have a smart phone or other technology to be able to use that information,0,0,0,0,0,0,0,0,1,0,0,0,0,school
i have never misused it for personal aggrandizement i feel i have been falsely accused of having been greedy for money by some show me one article or piece or one job for which i have bargained for more,0,1,0,0,0,0,0,0,0,0,0,0,0,work
id choose being in class over being on vacation any day but at the moment im feeling more than a little mentally drained which makes vacation actually look desirable for a change,0,0,0,0,0,0,0,0,0,0,1,0,0,school
i felt privileged to represent his name and our relationship and feel that this tragic event has bonded the family together which is exactly what i imagine his grandmother would have wanted,0,0,0,0,0,0,0,0,0,0,1,0,0,family
i never go out without spf on or ill feel unprotected lol,1,0,0,0,0,0,0,0,0,0,0,0,0,health
i rarely find myself ever arguing with you guys and even when i do i feel it gets resolved far more quickly than most other families,0,0,0,0,0,0,0,0,1,0,0,0,0,family
i think it is time to call the doctor as my back is still hurting me to the point of feeling very distracted,0,1,0,0,0,0,0,0,0,0,0,0,0,health
i get angry with myself over complaining in my mind when i should feel glad that we have food to eat and a place to live,0,0,0,0,0,0,0,0,1,0,0,0,0,food
im feeling productive sometimes that means i get a nap too,0,0,0,0,0,0,0,0,1,0,0,0,0,sleep
i am feeling quite irritable after my run tonight i left the house to run to the club feeling sore and tight in the legs and then decided to run with my n,0,1,0,0,0,0,0,0,0,0,0,0,0,exercise
i feel beaten down by my lifes work and struggles and am entirely prepared to never again have to bow in humility to the corporate monsters,0,0,0,0,0,0,0,0,0,0,1,0,0,work
i feel like kind of weird leaving your table with food just for the clothing,1,0,0,0,0,0,0,0,0,0,0,0,0,food
i still feel like a beginner when it comes to painting and luckily i have some talented friends who i reach out to when i need help,0,0,0,0,0,0,0,0,1,0,0,0,0,friends
im not feeling uptight about it it affords a good laugh,1,0,0,0,0,0,0,0,0,0,0,0,0,recreation
i feel technically fine just tired and sleepy,0,0,0,0,0,0,0,0,1,0,0,0,0,sleep
i realised that feeling like that is just not worth it even though i was devastated in the beginning to not be able to eat chocolate,0,0,0,0,0,0,0,0,0,0,1,0,0,food
im starting to feel more sociable again i actually feel like going out and seeing friends rather than crying off because im feeling like a twisted knotted ball of pain,0,0,0,0,0,0,0,0,1,0,0,0,0,friends
i say may the god be with u then y are u still feeling scared,1,0,0,0,0,0,0,0,0,0,0,0,0,god
i reread for comfort the familiarity of a book whose plot i already know is easier to deal with when im feeling stressed than a new to me book with all its unknowns,0,0,0,0,0,0,0,0,0,0,1,0,0,recreation
i was sitting at my computer the other day daydreaming and feeling a little anxious that the holidays are just around the corner,1,0,0,0,0,0,0,0,0,0,0,0,0,recreation
i invest in my friendships i feel hurt when i perceive that this investment is not returned,0,0,0,0,0,0,0,0,0,0,1,0,0,friends
i and nikhil both were a part of my seamless and sacred sky reflects that medha does not lessen the importance of her love and feelings for nikhil as a casual temporary affair but as a needed and important milestone to reach to her destination,0,0,0,0,0,0,0,0,1,0,0,0,0,love
i should be writing for nano and not surfing the web but it s been sucky at work the last three days and i m feeling rebellious,0,1,0,0,0,0,0,0,0,0,0,0,0,work
