text,afraid,angry,anxious,calm,confused,disgusted,excited,frustrated,happy,proud,sad,satisfied,surprised,topic
I took the time to make a home cooked meal last night and it was so good. I made acorn squash with apples and sausage. Getting to enjoy this meal made me very satisfied because it was so tasty and very happy that it turned out so good. This meal also makes me nostalgic for other times when I have made this delicious meal.,0,0,0,0,0,0,0,0,1,0,0,1,0,food
I had a great workout today. Everything flowed and I felt strong. I warmed up by playing some basketball then ran a couple of miles and then did sprints. I felt alive and working out really cleared my mind today.,0,0,0,1,0,0,0,0,1,1,0,0,0,exercise
My mother is older and having some health problems. I spoke to her on the phone and learned that she refused to take some medicine the doctor gave her. I am frustrated because I feel like she does not want to get better.,0,0,1,0,0,0,0,1,0,0,0,0,0,family
The sleep was good,0,0,0,1,0,0,0,0,0,0,0,0,0,sleep
"I felt good and awake yesterday while doing my daily activities. It was a very salient day and my health was in tip top shape, as far as how I felt.",0,0,0,0,0,0,0,0,1,0,0,0,0,health
The food I had was delicious. My girlfriend prepared a very nice meal. It had me ready to take on the rest of the night.,0,0,0,0,0,0,0,0,0,0,0,1,0,food
I'm so far behind in my school work and I wasn't happy with my last grade. I think the professor is an idiot who has no idea what he's doing. It feels like he's just going through the motions and that makes me anxious because I want a good grade.,0,0,1,0,0,0,0,0,0,0,0,0,0,school
I was able to accomplish a big quota at work and that made me feel both satisfied and proud of myself to know that I actually accomplished what I have being working so hard for.,0,0,0,0,0,0,0,0,0,1,0,1,0,work
i slept so good and hard like a baby it was relaxing and i needed to get some rest so i felt so much better the next day,0,0,0,1,0,0,0,0,0,0,0,1,0,sleep
"I love going to bed at night and getting much needed rest, i am always looking forward to the next day and what lies ahead.",0,0,0,0,0,0,0,0,0,0,0,1,0,sleep
"Thr aforementioned ""alone time""w ith my wife last night.  We made love, and as always, it was a pleasurable experience.",0,0,0,0,0,0,1,0,1,1,0,1,0,love
"Exercising after a busy days felt really good.  It energized me and made me somewhat proud to see that I was meeting my goal for exercising.  I felt very relaxed afterwards and was able to enjoy the rest of the evening, feeling better physically and mentally as a result.  It helped to clear my mind.",0,0,0,0,0,0,0,0,1,1,0,1,0,exercise
we had pizza again so tired of pizza gross,0,0,0,0,0,1,0,0,0,0,0,0,0,food
My dog was really well behaved. She is my family and i love her so much.,0,0,0,0,0,0,0,0,0,1,0,0,0,family
I'm getting old. I take naps in the afternoon. Even if I only sleep for 20 minutes it's usually good for me. That's about what it was yesterday. Just that little bit of sleep got me going for the rest of the day.,0,0,0,1,0,0,0,0,0,0,0,1,0,sleep
I was able to finish all of my work quickly with no errors. After i had some time to myself to be able to do what i wanted.,0,0,0,0,0,0,0,0,1,1,0,1,0,work
I really appreciated the food I ate yesterday.  Lunch was my favorite part of the meal.  I considered how I eat much more healthier now.  I ate a veggie wrap which was absolutely delicious.  I had feelings of being calm since I always feel serene when I eat a good and healthy meal.,0,0,0,1,0,0,0,0,0,0,0,0,0,food
I took a nap and have a very good rest.,0,0,0,0,0,0,0,0,0,0,0,1,0,sleep
I made a really nice dinner of fresh baked potatoes with vegetarian Mexican seasoned beans and avocado. It was a really healthy meal and my vegan son enjoyed it. I was proud that I was able to come up with it off the cuff and that it turned out so well.,0,0,0,0,0,0,1,0,0,0,0,0,0,food
We had left over spaghetti and meat balls for dinner with garlic toast. It was very good and it made me feel calm and happy.,0,0,0,1,0,0,0,0,1,0,0,1,0,food
I don't usually get enough sleep so it's always good when I can get to bed a little early and try to catch up.,0,0,0,0,0,0,0,0,0,0,0,1,0,sleep
"I didn't sleep well, it felt as though I was stressed out all night. I kept waking up and feeling like I needed to get up and do something. I couldn't think of anything to do, so I kept trying to go back to sleep.",0,0,1,0,0,0,0,0,0,0,1,0,0,sleep
"I managed to finish my work relatively early for the day. I'm glad because this opened up free time for me to do some after work self study with web development. My day was tiring, but I felt rewarded from what I was able to accomplish. I felt like I put in a fulfilling workday that was packed with work to keep me feeling busy without feeling overwhelmed.",0,0,0,1,0,0,0,0,0,0,0,1,0,work
"I cooked a fairly involved dinner last night. I usually don't really cook at all, but I devoted a little more time to food preparation and cooking last night for dinner than usual. It didn't take a ton of time and wasn't too involved, but I was definitely happy with the final product. I was proud of myself for cooking a dish and having it turn out tasty. It looked and tasted good. Plus it didn't take a ton of time. I was happy with the results.",0,0,0,0,0,0,0,0,1,1,0,1,0,food
I made breakfast and lunch for my family yesterday and we had leftovers at dinner.,0,0,0,0,0,0,0,0,1,0,0,0,0,food
"I was so tired when we got home last night that I was in bed and asleep by 8:30 pm.  Falling asleep when I'm so tired is sometimes a little difficult, but last night I just drifted easily off.  What a nice way to end the day and prepare for the next.  I'm so happy that I don't have sleeping problems.",0,0,0,1,0,0,0,0,0,0,0,0,0,sleep
Recently food a great chili recipe. It uses cooked pot roast and a can of beer. It is really comfort food.,0,0,0,0,0,0,0,0,1,0,0,0,0,food
I had a couple of good meals yesterday that helped me feel a bit better from being sick lately,0,0,0,0,0,0,0,0,0,0,0,1,0,food
by excercising my heart it was such a great meeting of my body and mind. I felt extremely calm afterword.,0,0,0,1,0,0,0,0,0,0,0,0,0,exercise
My friend's mother passed. I learned about it and said special prayers and planned on the bouquet I would order today.,0,0,0,0,0,0,0,0,0,0,1,0,0,friends
"My husband came home from work with a cold. He sounds awful, and he didn't take anything for it. I am anxious that I am going to get sick also.I don't want his cold.",0,0,1,0,0,0,0,1,0,0,0,0,0,health
Work was typical.  I was frustrated by the stupid paperwork and other crap that I have to do instead of just being allowed to do my job.,0,0,1,0,0,0,0,1,0,0,0,0,0,work
It was nice to play a video game before work yesterday. I don't always get a lot of time to play but this new game I have is pretty fun even in small amounts. It's nice to still be able to do it once and a while.,0,0,0,0,0,0,0,0,1,0,0,0,0,recreation
I slept well yesterday,0,0,0,0,0,0,0,0,1,0,0,1,0,sleep
"I love being a tutor, even if it's only part-time. It warms my soul knowing that the help that I give them is instrumental in their passing an important class that is required for graduation.",0,0,0,0,0,0,1,0,1,1,0,1,0,work
I watched a movie with my parents. It was an excellent time. I loved it. I felt satisfied and we all had a good time watching the new Godzilla movie.,0,0,0,1,0,0,0,0,1,0,0,1,0,family
i feel very safe and happy when surrounded by my family,0,0,0,0,0,0,0,0,1,0,0,1,0,family
I had two bowls of Cheerios for breakfast (in milk). It's good to start the day with some breakfast cereal. It lasts me until lunch and tastes good.,0,0,0,0,0,0,0,0,0,0,0,1,0,food
I spent time with God. It was very relaxing.,0,0,0,1,0,0,0,0,1,0,0,0,0,god
"I had a really good night of rest, it is important to just sleep for 7-8 hours and to do so without interruption. I achieved that.",0,0,0,1,0,0,0,0,0,0,0,0,0,sleep
I enjoyed doing arts and crafts much of the day,0,0,0,1,0,0,0,0,0,0,0,0,0,recreation
I want to be closesr with my family and I worry about them.,0,0,0,0,0,0,0,0,0,0,1,0,0,family
"I went for a 5 mile run yesterday afternoon and it helped me burn off some nervous energy I had accumulated throughout the day, as well as some of the calories I had eaten earlier in the day. I felt happy and satisfied at the end of it.",0,0,0,1,0,0,0,0,0,1,0,1,0,exercise
God showed himself several times throughout the day in my interactions with people and things. I was so inspired by how God shows how he loves us if we just pay attention.,0,0,0,0,0,0,1,0,1,0,0,1,0,god
"While we had dinner, my girlfriend tried to cook chicken fajitas. It was a little unexpected and surprising",0,0,0,0,0,0,0,0,0,0,0,0,1,food
My brother baked a cake which tasted good.,0,0,0,0,0,0,0,0,1,0,0,1,0,food
I had a great hamburguer at a new place I went  to have lunch.,0,0,0,0,0,0,1,0,0,0,0,1,0,food
I spent quite a bit of time talking to my significant other about our day. We ate dinner together then relaxed with a cup of hot cocoa as the snow fell outside,0,0,0,1,0,0,0,0,1,0,0,1,0,love
I finally got enough sleep for a change.,0,0,0,0,0,0,0,0,0,0,0,1,0,sleep
"I was able to get a short nap in, at the middle of the day.  It felt good because I couldnt sleep well the night before.  I dont usually nap but today I really needed it and it helped a lot.",0,0,0,0,0,0,0,0,0,0,0,1,0,sleep
we are starting a new hobby,0,0,0,0,0,0,1,0,0,0,0,0,0,family
I lovve to exercise. It makes me feel good emotionally. It also makes me feel like I am doing something for myself. It is my small daily gift to myself.,0,0,0,1,0,0,0,0,0,1,0,0,0,exercise
Love for life was extremely salient yesterday because I realize how grateful I am to live where I live and be able to have the kind of job taht I now have after retiring from teaching.,0,0,0,1,0,0,0,0,1,0,0,0,0,love
I love my friends.We always share our feelings.We are spend time for our enjoyment.,0,0,0,0,0,0,0,0,1,1,0,1,0,friends
spending time with my husband and kids makes me happy. I was glad to spend quality time with family,0,0,0,1,0,0,0,0,1,1,0,1,0,family
Remindes my of all the food cooked for me by my husband!,0,0,0,0,0,0,0,0,0,0,0,0,0,food
I don't get enough sleep lately. It affects me throughout the day as I don't function as efficiently as I would like to. I also am not in good mood's most mornings and I definitely attribute it to lack of sleep. My quality of sleep is also terrible.,0,0,0,0,0,0,0,1,0,0,0,0,0,sleep
food is soo good best part of my day,0,0,0,0,0,0,0,0,1,0,0,0,0,food
I had a wonderful dinner evening meal with my family at home that was delicious but more importantly I got to share it with my entire family around the kitchen.,0,0,0,1,0,0,0,0,0,0,0,0,0,family
i slept 8 hours,0,0,0,0,0,0,0,0,1,0,0,0,0,sleep
Got to spend a nice evening with my husband.  It made up for not having a good day at work.  I was calm and had a pleasant evening.,0,0,0,1,0,0,0,0,1,0,0,0,0,family
"It was a slow day, one of the few slow days we've had at work. This means that I was able to get some of my personal stuff done that I have been putting off. So i felt rather accomplished.",0,0,0,0,0,0,0,0,1,0,0,0,0,work
"I was finally able to get a full night's sleep the night before, so I was well rested throughout the day. I actually went to sleep at a respectable time without any trouble too last night.",0,0,0,0,0,0,0,0,0,0,0,1,0,sleep
I checked an online order I made and it said that I would be receiving it today. The shipping was quick and I'm happy that I'll get to use what I purchased. I hope the product is good as it's one I haven't used before.,0,0,0,0,0,0,1,0,1,0,0,0,1,recreation
"I forgot to bring my lunch to work yesterday, so my lunch consisted of pop tarts that I brought as a possible snack. It was pretty pathetic and I was super hungry all afternoon.",0,0,0,0,0,0,0,0,0,0,1,0,0,food
a good night sleep is so important,0,0,0,0,0,0,0,0,0,0,0,1,0,sleep
"I made money and a large performance bonus, which is much needed and appreciated. Because of how large it was, I'll be able to buy all the presents for xmas that I want to buy and make a great Christmas for my family.",0,0,0,1,0,0,0,0,0,0,0,1,0,work
My mom sent me and my brothers a goofy joke about Lady Gaga's name.  It's nice to have someone who has a similar goofy sense of humor so we can text each other jokes all day.  We're lucky that we're a family that can laugh at almost anything.,0,0,0,0,0,0,0,0,1,0,0,1,0,family
I am almost done with a certification program to teach English as a second language. I'm happy about that and will be happy to finish.,0,0,0,0,0,0,0,0,1,0,0,0,0,school
I was contemplating God and realized that I was excited to meet God someday and escape this inferior world. I was thinking about how that would be greater than just about anything else.,0,0,0,1,1,0,1,0,1,0,0,0,0,god
I enjoyed watching a new movie with my son. We both really enjoyed it and sat for a long time afterwards talking about what we thought. It was nice to spend some one on one time with my son.,0,0,0,0,0,0,0,0,1,1,0,0,0,family
"Yesterday was the anniversary of the death of my great aunt, so I did some nice things for my grandma and picked her up a bottle of wine. I felt happy to spend time with her, but sad that she was upset and hurting.",0,0,0,0,0,0,0,0,1,0,1,0,0,family
"I spent quite a while chatting with my boyfriend over the phone last night. We live very far apart, and had just spent a 4 day weekend together but now are separated again so I was really missing him. We texted for well over an hour and it was really nice to catch up after being a part for a few days now. I miss him terribly.",0,0,0,0,0,0,1,0,1,0,0,1,0,friends
"I slept really good last night, but I didn't get enough sleep the two nights before that. I feel pretty good today, so the sleep was restorative.",0,0,0,0,0,0,0,0,0,0,0,1,0,sleep
"I have been trying to get more exercise lately and yesterday I took two very long walks, which I am feeling good about.  I need to keep that up because it will help with my weight loss and it will also make me feel better in general.",0,0,0,0,0,0,0,0,1,0,0,0,0,exercise
It's good to have a few friends to chat with about your day. I have a few people that I am close to and we try to encourage each other with our daily struggles.,0,0,0,0,0,0,0,0,0,0,0,1,0,friends
We went out to a local restaurant and had a nice dinner. They had a chicken special that was great and I had a nice glass of wine. My family and I had a great time chatting and laughing. It felt really good to relax.,0,0,0,0,0,0,0,0,1,0,0,1,0,food
I work out in the afternoon on most days so it's perhaps not the most salient thing ever but yesterday was otherwise mostly filled with work during the day and scheduled in the evening like I explained in both situations above. What was notable about exercising yesterday was hitting a new personal record on my bench press at 225lbs.,0,0,0,0,0,0,1,0,0,1,0,1,0,exercise
I am proud of my children and wife for all they try to do to help me. This one of the few things that gives me happiness.,0,0,0,0,0,0,0,0,0,1,0,0,0,family
I had trouble sleeping last night,0,1,1,0,0,0,0,1,0,0,0,0,0,sleep
I cooked dinner for myself and my wife. We both had a long day and I hadn't eaten very much. I was happy to get some food and it turned out to be very tasty. It was a good way to end a long day.,0,0,0,1,0,0,0,0,1,0,0,1,0,food
"I enjoyed eating a bacon cheeseburger from my favorite restaurant, Cheddars. I used to eat bacon cheeseburgers all the time when I was younger. The food made me feel happy and nostalgic.",0,0,0,0,0,0,0,0,1,0,0,1,0,food
I made myself dinner before going to work. I was in a rush so I made a sandwich on a bagel and ate it. I also ate a Girl Scout cookie as dessert. It was fairly normal.,0,0,0,1,0,0,0,0,1,0,0,0,0,food
"I ate waaaaay too much for breakfast and lunch (and dinner), so I always feel full but have had really good food. I'm always eating but I shouldn't be ever.",0,0,0,0,0,0,0,0,1,0,0,1,0,food
"I had a shift at my local Buddhist community Center in the evening. I wasn't sure if my friend would be there, since he took his girlfriend to Mexico for her operation. But he was there with her and we got to talk about her operation, which went well. He told me he saved thousands of dollars by taking her to Mexico for it, rather than having it here. I was happy to see she came through it ok and that they were back home.",0,0,0,0,0,0,1,0,1,0,0,1,0,friends
I ate quite ab it of good food. Girlfriend made buffalo chicken dip we ate with romaine lettuce. It was delicious. Reasonably salient because it's healthy and we're both losing weight pretty quickly.,0,0,0,0,0,0,0,0,1,0,0,1,0,food
I got to do a watercolor painting as well as make some music. I was very creative.,0,0,0,1,0,0,1,0,1,1,0,1,0,recreation
I enjoyed time with my husband last night. We were able to talk and catch up with each other as we snuggled.,0,0,0,0,0,0,0,0,0,0,0,1,0,love
I started a new workout routine this week and it felt great yesterday.  I can actually feel a difference it makes me feel more energetic. I am certain to continue with this routine.,0,0,0,0,0,0,0,0,0,1,0,1,0,exercise
Every day I spend about 5 to 10 minutes doing pushups burpies and planks and it makes me feel very fit,0,0,0,0,0,0,1,0,0,0,0,0,0,exercise
I saw my friend Nick yesterday. We played video games together. It was fun. I was happy.,0,0,0,0,0,0,0,0,1,0,0,0,0,friends
I enjoy sleeping so much. It is so peaceful and relaxing.,0,0,0,1,0,0,0,0,0,0,0,1,0,sleep
I was really happy about going to the gym to exercise. I wanted to take some time for me and take care of myself.,0,0,0,0,0,0,1,0,1,1,0,0,0,exercise
"Earlier in the day I took my son for a well visit at his pediatrician and it went very well. He cooperated with the doctor and the nurse, and even said he had a fun time afterwards.",0,0,0,0,0,0,0,0,0,1,0,0,0,family
I spent more time with my kid. I normally am frustrated and stessed in the morning but today I put that aside so that way I can spend more time together and bond.,0,0,0,0,0,0,1,0,1,0,0,1,0,family
"I had taken and participated in a new excercise class, that primarily would target the whole body in addition to cardiovascular excercise. It was a difficult experience, but I managed to perform all the excercises to a great ability, without feeling overtly exhausted or sore. Afterwards, I felt empowered and happy for participating in class, feeling motivated to pursue similar experiences in the future.",0,0,0,0,0,0,0,0,1,0,0,1,0,exercise
I was able to easily maintain my goal of 2 hours and 20 minutes of straight cardio for the first time.  I'm eager to expand my cardio to doing it 6 times a week.,0,0,0,0,0,0,0,0,0,1,0,0,0,exercise
"I played video games that night trying to relax, in the end it made me bored, I should have picked a different one.",0,0,0,0,0,0,0,0,0,0,0,0,0,recreation
It is important to get a goods night sleep,0,0,0,1,0,0,0,0,0,0,0,0,0,sleep
Since the work day was such a success we order Mexican from our favorite Mexican restaurant. And a donut for desert. It was pleasing and a great reward.,0,0,0,0,0,0,1,0,1,1,0,0,0,food
I helped my daughter with her Spanish and English homework.  I have started working with her again.  I was happy to do this and proud as she is really trying!!,0,0,0,0,0,0,0,0,1,1,0,0,0,family
"I didn't lose my appetite. But I can only eat soft foods, especially the first day. So I was hungry and jealous of everyone around me eating normally.",1,0,0,0,0,0,0,0,0,0,0,0,0,food
I cleaned my house pretty well and it felt great.,0,0,0,0,0,0,0,0,1,0,0,0,0,work
I had to finish a tough project at work. I was afraid I wouldn't get int done on time.,0,0,1,0,0,0,0,0,0,0,0,0,0,work
I had been having trouble sleeping for over a week.,0,0,0,0,0,0,0,1,0,0,0,0,0,sleep
I bought a bunch of snack foods since I had to work late and miss dinner. I decided to buy some snack foods I hadn't eaten in a long time but have been favorites since childhood such as pretzels and peanut butter crackers.,0,0,0,0,0,0,0,0,1,0,0,0,0,food
I had a very productive day at work. Got recognized by my boss after finishing long long progect,0,0,0,0,0,0,1,1,0,0,0,1,0,work
i like doing exercise to release stress,0,0,0,0,0,0,0,0,0,0,0,1,0,exercise
"Once the day was over, I got to relax and watch some YouTube videos before going to bed.  Before that, I got to eat my favorite salsa with chips, which just put me in a happy mood to watch a great short documentary.  I'm looking forward to having good dreams inspired by the documentary now.",0,0,0,1,0,0,0,0,0,0,0,1,0,recreation
I got a bonus payment for december and i am very happy for that.,0,0,0,0,0,0,0,0,1,0,0,0,0,work
I went to bed early yesterday. It was a great night's sleep. I got nearly 6 hours and had nearly 2 hours of deep sleep. Had a nice heart rate of 48 bpm.,0,0,0,0,0,0,0,0,1,0,0,1,0,sleep
The chicken wings I made yesterday were just awesome,0,0,0,0,0,0,1,0,1,0,0,1,0,food
My back has been bothering me.  It has prevented me from getting a good night's sleep.,0,0,1,0,0,0,0,1,0,0,0,0,0,sleep
Made a massive pot of spaghetti and fed the family last night. It was so good having them eat with us.,0,0,0,0,0,0,0,0,1,0,0,0,0,family
"I usually have a hard time sleeping well at night but not yesterday. I had an enjoyable day with family, I worked hard at my job, and overall had a very good day. Therefore, when it was time for bed, I was ready for it. I was even able to go to bed a little early. I slept through the night and felt very refreshed when I woke up.",0,0,0,1,0,0,0,0,0,0,0,1,0,sleep
"I know that I should not be feeling sad about how things are going in my love life.  Things are actually really good.  I just felt like he does not miss me the way that I miss him and that he really does not care about me the way that I care about him.  I know that these things aren't true, but our conversation left me feeling frustrated and sad.",0,0,0,0,0,0,0,1,0,0,1,0,0,love
I started knitting a hat yesterday. I made good progress on the ribbed part of the hat and I used my new needles. They're really nice.,0,0,0,0,0,0,1,0,1,0,0,0,0,recreation
"I had a good night rest yesterday which is a bit awkward, but it was enjoyable.",0,0,0,1,0,0,0,0,0,0,0,0,0,sleep
They don't make a lot of sense.,0,0,0,0,1,0,0,1,0,0,0,0,0,family
i am very healthy,0,0,0,0,0,0,1,0,0,1,0,0,0,health
I hit new goals with my cardio.,0,0,0,0,0,0,1,0,0,1,0,0,0,exercise
My son is doing great in his first year in college and he called me to say that he got a 95 on a test he was worried about and stressed over. I am very proud of him and the hard work he is putting in. He's really focused on getting good grades and not screwing up his college experience which is a concern of mine but so far so good.,0,0,0,1,0,0,0,0,1,1,0,0,0,family
"I went for a nice job this morning, it got the blood flowing and made me feel alert.",0,0,0,0,0,0,1,0,1,0,0,0,0,exercise
"I finally got up and worked out yesterday after a couple of weeks of not being able to get back into it. It made me feel powerful and in control, and helped me get back on track with my workout routine.",0,0,0,0,0,0,0,0,0,0,0,1,0,exercise
"I did a little cooking and planning for myself yesterday, and it involved re-thinking about my shopping plans for the week - I need more protein and some more variety for my daytime meals ad snacking.  Time to lower the sugar in my diet, and think about how to accomplish the food selection/diet without spending too much money or prep time.",0,0,1,0,0,0,0,0,1,0,0,1,0,food
"after yesterdays success, i and my team decided to have a special dinner. we went to a very good restaurant to celebrate. everything they had to offer felt very good and great. maybe it was due to the joy and happiness in the air. but the food was very much good.",0,0,0,0,0,0,0,0,1,0,0,0,0,food
I am proud that I cam taking care of myself and that I am healthy,0,0,0,0,0,0,0,0,1,1,0,0,0,health
I fell asleep very early last night. I fell asleep around 8:30 PM last night. I usually fall asleep around 10-11. I was surprised to fall asleep so early and so easily. I must have really needed it.,0,0,0,0,0,0,0,0,0,0,0,0,1,sleep
My health is good. Didn't feel ant pain.,0,0,0,0,0,0,0,0,0,0,0,1,0,health
I went to bed an hour and a half earlier than I usually do and my body really enjoyed the extra rest,0,0,0,1,0,0,0,0,0,0,0,0,0,sleep
"it was good to get a full eight hours of sleep last night, i needed it after the hectic work week thus far.",0,0,0,1,0,0,0,0,0,0,0,1,0,sleep
I got to spend time outside walking with my wonderful girlfriend. I felt very loved and appreciated just by being with her.,0,0,0,0,0,0,0,0,0,1,0,0,0,love
The lights kinda disturbed us when they fell and our dog being scared.,0,0,0,0,1,0,0,0,0,0,0,0,0,sleep
"Had at least a good chat and ambiance with family last night, which was pretty nice.",0,0,0,1,0,0,0,0,0,0,0,0,0,family
"My friend Jeff helped me set up my new computer. That was great, because I needed the help. He spent a few hours, and was very thorough.",0,0,0,0,0,0,0,0,1,0,0,0,0,friends
"After hearing the result from my relative, I need some time reflecting about myself. I prayed that she will be healed and I imagine how I feel when I am in her position. Maybe death won't be so bad because I can meet God then.",0,0,0,1,0,0,0,0,0,0,0,1,0,god
Because I am sick I had to miss one of my children's parent/teacher conferences yesterday. I feel ashamed like a bad parent because I couldn't go and feel the teachers may look down on me for it.,0,0,0,0,0,0,0,1,0,0,1,0,0,friends
I talked with my son online in The Netherlands. It was good to see him again.,0,0,0,0,0,0,1,0,1,1,0,0,0,family
"I slept great yesterday, i got a new box spring set up and holy crap it makes such a difference, I slept like a baby and i woke up feeling very refreshed. It set a great tone for yesterday.",0,0,0,1,0,0,0,0,0,0,0,0,0,sleep
"I slept in until almost noon. I never sleep that late, it was very surprising to me.",0,0,0,0,1,0,0,0,0,0,0,0,1,sleep
