text,afraid,angry,anxious,calm,confused,disgusted,excited,frustrated,happy,proud,sad,satisfied,surprised,topic
i am thankful for my blue energy that i feel comfortable to work on repetitive work like generating reports for hours,0,0,0,0,0,0,0,0,1,0,0,0,0,work
i have a great family and i feel as if she has missed a great deal by not electing to meet them,0,0,0,0,0,0,0,0,0,0,1,0,0,family
i did go out with a friend and we did end up doing sexual things and i do feel that emotional connection with him,0,0,0,0,0,0,0,0,0,0,1,0,0,friends
i love feeling them move even when they kick a vital organ,0,0,0,0,0,0,0,0,1,0,0,0,0,love
i feel the need to compensate with only the most perfect jacket as a topper to cover where my boobs do not fulfill their duties,0,0,0,0,0,0,0,0,1,0,0,0,0,work
i love you and cuddle you a lot and be very affectionate but sometimes he does little silly nice sweet things that show me how much he cares and that he too gets paranoid about me and he make me feel soooooooooooo giggly,0,0,0,0,0,0,0,0,1,0,0,0,0,love
i was going down the shaky elevator into the noisy engine room and for the first time it came to me to call it a job which caused me to feel a curious mix of strength relief and disappointment,0,0,0,0,0,0,0,0,0,0,0,0,1,work
i feel so ecstatic to spend quality time with friends online and off,0,0,0,0,0,0,0,0,1,0,0,0,0,friends
i feel very accepted in this family but the language and culture barriers are very unfamiliar to me,0,0,0,0,0,0,0,0,1,0,0,0,0,family
i am sick i want my husband and my kids to cuddle me while i am laying there feeling miserable,0,0,0,0,0,0,0,0,0,0,1,0,0,family
i cannot shake the feeling that there is so much more out there and not the kind of frantic doing that i have already mentioned and we are not doing the job,1,0,0,0,0,0,0,0,0,0,0,0,0,work
im looking good and feeling good other than this crappy cold im dealing with,0,0,0,0,0,0,0,0,1,0,0,0,0,health
i have friends who have done what they can to help me but right now i feel like everything has been in vain,0,0,0,0,0,0,0,0,0,0,1,0,0,friends
i think promises made between friends secrets kept and obligations met are the things that hold friendships together and make both parties feel valued and respected,0,0,0,0,0,0,0,0,1,0,0,0,0,friends
i walk out of the school cafeteria feeling humiliated i don t know what to do but one thing s for sure i have to get my own copy of chapter two of economics,0,0,0,0,0,0,0,0,0,0,1,0,0,school
i was glad to sleep in my own bed last night i feel melancholy and lazy today,0,0,0,0,0,0,0,0,0,0,1,0,0,sleep
i feel for having such a friendly friends especially koreans which now i can sit beside greet or even talk to them whenever i like,0,0,0,0,0,0,0,0,1,0,0,0,0,friends
i didn t feel determined to get my homework done or do anything,0,0,0,0,0,0,0,0,1,0,0,0,0,work
i love the way you scatter words together like a witch doctor with bones into magical sentences that make my brain feel funny,0,0,0,0,0,0,0,0,0,0,0,0,1,love
i feel like an ungrateful shithead for saying this but i honestly feel like quitting my job right now,0,0,0,0,0,0,0,0,0,0,1,0,0,work
i now feel that i am only an unfortunate bystander caught up in this twister of family complications,0,0,0,0,0,0,0,0,0,0,1,0,0,family
i cried myself to sleep one night just because i feel ugly and fat,0,0,0,0,0,0,0,0,0,0,1,0,0,sleep
i know that he doesn t sleep well when i m there so technically it was my fault but i still didn t like feeling blamed,0,0,0,0,0,0,0,0,0,0,1,0,0,sleep
i feel humiliated and feel like i can t show my face there or on campus,0,0,0,0,0,0,0,0,0,0,1,0,0,school
i feel so lonely all the time because i have so many good friends but they all have one person which is more important than me and well they choose to hang out with them so im left alone always,0,0,0,0,0,0,0,0,0,0,1,0,0,friends
i know the feeling of radiant health that happened during that time,0,0,0,0,0,0,0,0,1,0,0,0,0,health
i examined my feelings decided that i had no idea whatsoever as to whether what i was doing was acceptable or not and decided to continue until i either had an opinion either way or there was a complaint,0,0,0,0,0,0,0,0,1,0,0,0,0,exercise
i just love the after feeling and somehow it gives u a more radiant complexion,0,0,0,0,0,0,0,0,1,0,0,0,0,love
i feel cranky and dull from the additional hour of sleep in the fall,0,1,0,0,0,0,0,0,0,0,0,0,0,sleep
i feel somewhat free because i usually see this person a lot and we have very many mutual friends,0,0,0,0,0,0,0,0,1,0,0,0,0,friends
i feel its the perfect time to analyse e and work out why this year had so many disappointments and who is worthy of walking away with the title of winner of e,0,0,0,0,0,0,0,0,1,0,0,0,0,work
i feel pissed off but maybe that is because i had some chocolate bars today which are not good for mood,0,1,0,0,0,0,0,0,0,0,0,0,0,food
i had been feeling a bit discouraged earlier today and then i saw something my mom had written to me and it instantly made me feel better,0,0,0,0,0,0,0,0,0,0,1,0,0,family
i told them about the food we normally eat and the food we eat that they feel disturbed,0,0,0,0,0,0,0,0,0,0,1,0,0,food
i feel like i dont belong and or accepted by any of the three families,0,0,0,0,0,0,0,0,1,0,0,0,0,family
i have been feeling very discontent at my job i don t feel any sort of challenge when i am at work,0,0,0,0,0,0,0,0,0,0,1,0,0,work
i feel greedy as if i have this great treasure inside of me and im stowing it away for myself to enjoy while i watch others suffer,0,1,0,0,0,0,0,0,0,0,0,0,0,recreation
i feel offended for my friends in the fine art world,0,1,0,0,0,0,0,0,0,0,0,0,0,friends
i also feel like a lousy friend a lousy and a lousy leader,0,0,0,0,0,0,0,0,0,0,1,0,0,friends
i feel my ability to read others mind may the rotten mango,0,0,0,0,0,0,0,0,0,0,1,0,0,food
i will have my true loves kiss i will feel like cinderella and i will meet prince charming i just wont marry him,0,0,0,0,0,0,0,0,1,0,0,0,0,love
i feel thoroughly depressed at my culinary and parenting skills whenever i read a href https food,0,0,0,0,0,0,0,0,0,0,1,0,0,food
i often leave work feeling pretty drained and not in the right kind of state for running,0,0,0,0,0,0,0,0,0,0,1,0,0,work
i was flying back to guatemala the night before my birthday and was feeling pretty depressed about leaving my family coming back to my reality of poor guatemala and having to spend my birthday alone in a hostel near the airport,0,0,0,0,0,0,0,0,0,0,1,0,0,family
i eat whenever i feel unhappy or have an emotional need,0,0,0,0,0,0,0,0,0,0,1,0,0,food
i feel like god and my friends have been so amazing in blessing me and im super thankful i can share this with others,0,0,0,0,0,0,0,0,0,0,0,0,1,friends
i also feel that i m teaching her a valuable skill how to get back to sleep at night which is a really good tool to have,0,0,0,0,0,0,0,0,1,0,0,0,0,sleep
i can definitely tell that my focus is strong in school because instead of feeling helpless and discouraged i simply kicked into this is what has to happen mode,1,0,0,0,0,0,0,0,0,0,0,0,0,school
i felt afraid when i smoked maryhuana for the first time in my life with a lot of friends in the middle of the street at day brake,1,0,0,0,0,0,0,0,0,0,0,0,0,friends
i love today alot even thou my body is feeling dull,0,0,0,0,0,0,0,0,0,0,1,0,0,love
i am fiercely protective of my brother so when i overhear the arguments they have and how he runs after her i feel uselessly mad,0,1,0,0,0,0,0,0,0,0,0,0,0,family
i went out with my family and at the end i feels boring,0,0,0,0,0,0,0,0,0,0,1,0,0,family
i dont have a god to turn to doesnt mean i dont feel offended by that,0,1,0,0,0,0,0,0,0,0,0,0,0,god
i love that i get to dress up and feel glamorous once a year,0,0,0,0,0,0,0,0,1,0,0,0,0,love
i was hungry and not feeling quite satisfied with my shakes and bars and i did eat a few bites of grilled chicken,0,0,0,0,0,0,0,0,1,0,0,0,0,food
this emotion happened when i passed my primary school examination and was selected for secondary school,0,0,0,0,0,0,0,0,1,0,0,0,0,school
i went home and fell asleep in my bed waking up feeling horrible,0,0,0,0,0,0,0,0,0,0,1,0,0,sleep
i feel rejected by my former classmates and i feel disconnected from my friends in that either i alone among them understand the full context of lies that surround us or that i am the worst and accepting them,0,0,0,0,0,0,0,0,0,0,1,0,0,friends
i did eventually do this i feel that in my lack of knowledge and in his inability to understand my points the friendly debate was taken too far and it reached the point where it kept going in circles,0,0,0,0,0,0,0,0,1,0,0,0,0,friends
i feel a bit pathetic admitting that it is my chocolate habit which is out of control but it really is,0,0,0,0,0,0,0,0,0,0,1,0,0,food
i feel kind of shaken as if an old friend had died,1,0,0,0,0,0,0,0,0,0,0,0,0,friends
i love the feeling of being terrified heart pounding hair raising skin prickling you know generally being scared out of my wits,1,0,0,0,0,0,0,0,0,0,0,0,0,love
i continued to feel rotten upon our arrival to the extent that i shunned a saturday night with friends in shadwell for the sofa,0,0,0,0,0,0,0,0,0,0,1,0,0,friends
i was feeling bouncy this morning as my friend is canada tomorrow,0,0,0,0,0,0,0,0,1,0,0,0,0,friends
i for lunch but the sushi guy took twenty minutes on my order so i had to walk into human variation with sushi in hand and eat it there feeling obnoxious for the smell of fish,0,1,0,0,0,0,0,0,0,0,0,0,0,food
i dont know how people finish off their first year of university because i am struggling and feeling damn restless about it as well,1,0,0,0,0,0,0,0,0,0,0,0,0,school
i am feeling just a little bit resentful that rick is not content staying in a dead end job,0,1,0,0,0,0,0,0,0,0,0,0,0,work
i also feel like no one is supporting my writing and it is hard enough when strangers are not supporting it but when people you know don t then it hurts,0,0,0,0,0,0,0,0,1,0,0,0,0,work
i feel reassured knowing that she is span lang en gb style font family times new roman serif font size,0,0,0,0,0,0,0,0,1,0,0,0,0,family
i only do cakes when i feel like i can make it perfect or close to it,0,0,0,0,0,0,0,0,1,0,0,0,0,food
i get stressed from work but i feel more tortured when we have no work and rest,0,1,0,0,0,0,0,0,0,0,0,0,0,work
physical violence a friend wouldnt listen to me i repeatedly tried to warn him,0,1,0,0,0,0,0,0,0,0,0,0,0,friends
i feel it s important to have that last meal today tomorrow soon,0,0,0,0,0,0,0,0,1,0,0,0,0,food
i love the feeling of opening an assignment and being either surprised in a good way or impressed,0,0,0,0,0,0,0,0,0,0,0,0,1,love
i walked out of that lift feeling like my bad hair day was actually kind of awesome,0,0,0,0,0,0,0,0,0,0,1,0,0,exercise
i used to feel such strong attractions fall in love and have passionate love affairs,0,0,0,0,0,0,0,0,1,0,0,0,0,love
i never had that feeling because nobody hates me becaue i amn popular in school and the coolest teenager ever,0,0,0,0,0,0,0,0,1,0,0,0,0,school
i did confide some of these feelings with my friend and was surprised to find out that hey i am not the only one,0,0,0,0,0,0,0,0,0,0,0,0,1,friends
i love him for always making me feel better about myself and life in general,0,0,0,0,0,0,0,0,1,0,0,0,0,love
i have a feeling eno sings theyre in lockers theyre in schools rather than theyre rockers or the ludicrous pair of knockers,0,0,0,0,0,0,0,0,0,0,0,0,1,school
heard about someone telling lies about me to my best friend,0,1,0,0,0,0,0,0,0,0,0,0,0,friends
ive been feeling a little jaded about my work wardrobe lately i must say,0,0,0,0,0,0,0,0,0,0,1,0,0,work
i have spent the last hours procrastinating and eating not to mention browsing through my music trying to find something to listen to i hate feeling so indecisive,1,0,0,0,0,0,0,0,0,0,0,0,0,food
i cannot shut off my feelings or hormones and i know that i have to stay strong for mr t for my parents for my friends who think i m keeping it together,0,0,0,0,0,0,0,0,1,0,0,0,0,friends
i was feeling a bit resentful that i had just slaved away for years and my hard work seemed unrecognizable to others in my community and my society,0,1,0,0,0,0,0,0,0,0,0,0,0,work
i feel distraught and sad with those who made my friends unhappy,1,0,0,0,0,0,0,0,0,0,0,0,0,friends
i love that we have created a friendship and that i can just stop by to check in and always feel welcomed,0,0,0,0,0,0,0,0,1,0,0,0,0,love
i saw my own smile of satisfaction saw myself hugging my chest and feeling rich love inside it and opening my arms to him as i buried my face in his neck,0,0,0,0,0,0,0,0,1,0,0,0,0,love
i remember the loneliness the desperation the feeling of being so unhappy that i wished i could lie down and sleep the eternal sleep,0,0,0,0,0,0,0,0,0,0,1,0,0,sleep
i borrowed this white killer pumps from my friend nin and while wearing this yes i felt a little bit taller but i felt like after the shoot i can no longer feel my feet because its aching so much,0,0,0,0,0,0,0,0,0,0,1,0,0,friends
when i was trying for a girl who i really liked and cared for and thought she felt the same way too but she didnt like the idea and just wanted to stay friends,0,0,0,0,0,0,0,0,0,0,1,0,0,friends
i do feel like ive been a neglectful friend but its due to the fact that i feel like a hinderance so i just stay away,0,0,0,0,0,0,0,0,0,0,1,0,0,friends
i was feeling brave so i ordered the frog legs,0,0,0,0,0,0,0,0,1,0,0,0,0,food
i feel like a horrible person for even assuming that any of my friends would do any of this,0,0,0,0,0,0,0,0,0,0,1,0,0,friends
im not feeling shitty because of my crappy diet,0,0,0,0,0,0,0,0,0,0,1,0,0,food
i feel superior to you because i love and forgive you whether you deserve it or not,0,0,0,0,0,0,0,0,1,0,0,0,0,love
i and asian fusion dinning experience with a vibrant feel that has delighted this girl s palate,0,0,0,0,0,0,0,0,1,0,0,0,0,food
i was done working out an hour later and i was feeling hopeful,0,0,0,0,0,0,0,0,1,0,0,0,0,work
i was so angry with a patient who refused to take drugs,0,1,0,0,0,0,0,0,0,0,0,0,0,health
i again became friends with sunday didnt feel all to friendly to the legs,0,0,0,0,0,0,0,0,1,0,0,0,0,friends
i feel jaded by life i tell myself to remember that i am from the hearts of true love,0,0,0,0,0,0,0,0,0,0,1,0,0,love
i was really working a good program i wouldnt feel angry,0,1,0,0,0,0,0,0,0,0,0,0,0,work
im in love but feel so insecure the worst part is that my insecurity leads me to do weird things,1,0,0,0,0,0,0,0,0,0,0,0,0,love
i feel in the depths of despair a sweet comment from you lovely people has made my day so much better and gives me hope and strength to keep moving forward and follow my love and passion,0,0,0,0,0,0,0,0,1,0,0,0,0,love
i remember being completely in love and feeling safe and happy,0,0,0,0,0,0,0,0,1,0,0,0,0,love
i feel intimidated by the great women in my family tree,1,0,0,0,0,0,0,0,0,0,0,0,0,family
i got my feelings hurt at a school sports banquet last night,0,0,0,0,0,0,0,0,0,0,1,0,0,school
i am feeling the weight of supporting my family the only one way i know how,0,0,0,0,0,0,0,0,1,0,0,0,0,family
i feel like it has actually mad them better because i feel like thats the easiest way to talk to most of my friends,0,1,0,0,0,0,0,0,0,0,0,0,0,friends
i came home from work today feeling satisfied that work went alright,0,0,0,0,0,0,0,0,1,0,0,0,0,work
i think that tatsumis feelings over kyoto have resolved and hell go to bed that night feeling relaxed,0,0,0,0,0,0,0,0,1,0,0,0,0,sleep
i said feeling slightly groggy from last night s partying with my friends laura and hannah,0,0,0,0,0,0,0,0,0,0,1,0,0,friends
i feel jealous when a friend gets to do something i wish i could do,0,1,0,0,0,0,0,0,0,0,0,0,0,friends
i feel we should remain as faithful to buddys music as possible for me and me alone it seems the original records are the prime reference it ends up as an interpretation of an interpretation of a tribute,0,0,0,0,0,0,0,0,1,0,0,0,0,friends
i had my dad for years of my life and now hes been gone from it for i feel glad that i had him for the time i did,0,0,0,0,0,0,0,0,1,0,0,0,0,family
i sometimes find myself crying in the school bathroom because i feel so unhappy,0,0,0,0,0,0,0,0,0,0,1,0,0,school
i asleep me alone feeling really sorry for myself,0,0,0,0,0,0,0,0,0,0,1,0,0,sleep
i have been going to taekwondo on my set schedule and i feel very energetic and happy after each day i am there,0,0,0,0,0,0,0,0,1,0,0,0,0,exercise
i started this journal back when because all my close friends were reading the blog on my website uninhibited frequently and i started to feel inhibited by that,1,0,0,0,0,0,0,0,0,0,0,0,0,friends
i feel burdened with hate and the felt the discomfort of not thinking about my friends my true friends,0,0,0,0,0,0,0,0,0,0,1,0,0,friends
i feel honoured to have such wonderful and supportive friends,0,0,0,0,0,0,0,0,1,0,0,0,0,friends
i feel like the kids have accepted me as a friend into their circles,0,0,0,0,0,0,0,0,1,0,0,0,0,friends
i still know exactly how he always made me feel because i still feel that when im sleeping and have pleasant dreams about him,0,0,0,0,0,0,0,0,1,0,0,0,0,sleep
i know people are going to say well you had a valentine you dont know how i feel i was shown love like never before this year and im appreciative,0,0,0,0,0,0,0,0,1,0,0,0,0,love
i always feel like i m the most unimportant person in my group of friends,0,0,0,0,0,0,0,0,0,0,1,0,0,friends
i really feel thankful for the love i had from them and the things they taught me,0,0,0,0,0,0,0,0,1,0,0,0,0,love
i did notice i could get boring arduous tasks done without feeling like i was being tortured today,0,1,0,0,0,0,0,0,0,0,0,0,0,work
i also could not just ask them how do they feel they are sociable enough to have other friends to talk to,0,0,0,0,0,0,0,0,1,0,0,0,0,friends
i feel in love with a women she was a player we broke up for the th time i feel like my heart is bleeding feels like i have a paper heart,0,0,0,0,0,0,0,0,0,0,1,0,0,love
departure of a very close friend for a long stay overseas,0,0,0,0,0,0,0,0,0,0,1,0,0,friends
i will take a few steps plop down and pick up and start walking again or maybe start crawling if shes feeling impatient,0,1,0,0,0,0,0,0,0,0,0,0,0,exercise
im feeling like the lunches are dull,0,0,0,0,0,0,0,0,0,0,1,0,0,food
i was heartbroken and shattered so feeling more determined than ever to stick to my veganism i take a small pinch of cheese sprinkle it in the very centre of my pizza and when it is cooked i eat around it,0,0,0,0,0,0,0,0,1,0,0,0,0,food
my mother treated me unjustly as if i was a little child i said mean things i was unable to defend myself adequately,0,1,0,0,0,0,0,0,0,0,0,0,0,family
im very insecure and i feel ugly all the time so to know that someone in this school liked me is a big thing for me,0,0,0,0,0,0,0,0,0,0,1,0,0,school
i slept well last night but i feel rotten its definitely a binge hangover i even had the nausea headache and leg pains,0,0,0,0,0,0,0,0,0,0,1,0,0,sleep
im not in the best place eating wise right now but i do not feel doomed desperate or helpless,0,0,0,0,0,0,0,0,0,0,1,0,0,food
im feeling grumpy i eat some protein,0,1,0,0,0,0,0,0,0,0,0,0,0,food
i actually started some hysterical weeping as i was packing and getting ready for the preslar family christmas party because i felt so rotten but troy who by then was starting to feel pretty rotten himself convinced me that we should still go to st,0,0,0,0,0,0,0,0,0,0,1,0,0,family
i always feel that we are so deprived of peanut butter offerings in the uk we are starting to see some improvements in the ice cream department however when it comes to chocolate,0,0,0,0,0,0,0,0,0,0,1,0,0,food
i feel as though thats our generations unfortunate fate,0,0,0,0,0,0,0,0,0,0,1,0,0,family
i feel enormously privileged that i have a lovely group of quilting buddies that offer so much support and advise and is there for me when things go a bit wrong they are all very special to me and i am so looking forward to meeting up with all of them at the festival of quilts,0,0,0,0,0,0,0,0,1,0,0,0,0,friends
i start to remember how desperately i felt when trying to get pregnant after feeling impressed to start having a family and soon finding that its not as easy as you think to just get pregnant,0,0,0,0,0,0,0,0,0,0,0,0,1,family
i really hope everyone feels well again,0,0,0,0,0,0,0,0,1,0,0,0,0,health
i eat that extra points meal i always find myself feeling unhappy with my choice and wishing i hadn t done it,0,0,0,0,0,0,0,0,0,0,1,0,0,food
i read the symptoms described on webmd and the more my friend talked about the anatomy of the hand and why my wrist and fingers would feel as they did the more convinced i was that they were perfectly correct,0,0,0,0,0,0,0,0,1,0,0,0,0,friends
i feel like anyone would be hesitant to hand the job to someone who had a b in the class,1,0,0,0,0,0,0,0,0,0,0,0,0,school
i feel when i see a violent world around where love happiness seem to be a thing of the past where present stands for ba,0,1,0,0,0,0,0,0,0,0,0,0,0,love
i feel comfortable with about falling in love with someone that really cares and makes me happy it s about doing what i feel like to do and not rushing decisions because i have a lifetime to make,0,0,0,0,0,0,0,0,1,0,0,0,0,love
i have no idea how im going to sleep tonight or why im feeling so troubled right now,0,0,0,0,0,0,0,0,0,0,1,0,0,sleep
i both feel terrific and were sleeping really well and,0,0,0,0,0,0,0,0,1,0,0,0,0,sleep
i feel frightened by you to fall in love equals weakness am i ready to be foolish and let you be the reason for my happiness sadness or anger,1,0,0,0,0,0,0,0,0,0,0,0,0,love
i remember watching friends and friends of friends go off to jonas brothers concerts while i sat home feeling extremely jealous,0,1,0,0,0,0,0,0,0,0,0,0,0,friends
i feel needy of love of hugs for kisses needy for compation for your touch for you,0,0,0,0,0,0,0,0,0,0,1,0,0,love
i had already gone on my morning run with gyp and was feeling fairly energetic,0,0,0,0,0,0,0,0,1,0,0,0,0,exercise
i always feel so humiliated reader because god s watched me cry a million times screaming in some intangible emotional agony but i bet he wonders when it ll actually be enough for me,0,0,0,0,0,0,0,0,0,0,1,0,0,god
i was probably feeling more emotional than i would have otherwise but as i sat there scanning my beautiful surroundings my mind raced with thoughts of jon my kids my childhood my sister and my recent exit from mormonism,0,0,0,0,0,0,0,0,0,0,1,0,0,family
i feel anyway never afraid of the sea but a healthy respect for the ocean and a sense of harmony and balance,1,0,0,0,0,0,0,0,0,0,0,0,0,health
i feel really ridiculously awkward on a bike,0,0,0,0,0,0,0,0,0,0,1,0,0,exercise
i got tired of feeling like a stupid worthless human being since i was not working,0,0,0,0,0,0,0,0,0,0,1,0,0,work
im around my friends its fine but as soon as you get me in front of people and i have to talk i feel like a timid year old thats afraid of the world,1,0,0,0,0,0,0,0,0,0,0,0,0,friends
i feel a beggar at a feast when watching this surprisingly intelligent film,0,0,0,0,0,0,0,0,1,0,0,0,0,food
i feel like the classroom environment is generally positive and even though i have to get on them often it is done in a positive way,0,0,0,0,0,0,0,0,1,0,0,0,0,school
i do feel burdened sometimes having to run the family in a way,0,0,0,0,0,0,0,0,0,0,1,0,0,family
i feel so damaged because of the an and alcoholism and its easy to view myself as a mess with little to contribute to friendships and other relationships,0,0,0,0,0,0,0,0,0,0,1,0,0,friends
i feel anguished and i dont want to eat my bread with butter spread on it i want herb flavoured crem bonjour,0,0,0,0,0,0,0,0,0,0,1,0,0,food
i love that when i feel cute running i feel fast,0,0,0,0,0,0,0,0,1,0,0,0,0,love
im feeling friendly having just talked to george and i say howre you doing,0,0,0,0,0,0,0,0,1,0,0,0,0,friends
i feel so blessed to be surrounded by such amazing friends,0,0,0,0,0,0,0,0,1,0,0,0,0,friends
i feel extremely blessed to be her friend to have heard her sing in her living room to have held her babes close,0,0,0,0,0,0,0,0,1,0,0,0,0,friends
i might have been feeling angry that a driver cut me off sad that a friend was experiencing a hardship or frustrated that i couldn t find a parking space but i thought it best not to express the feelings,0,1,0,0,0,0,0,0,0,0,0,0,0,friends
i feel so lucky to have eaten in so many italian homes over this past year,0,0,0,0,0,0,0,0,1,0,0,0,0,food
i dont know why but i feel rather amused at my friends getting mips,0,0,0,0,0,0,0,0,1,0,0,0,0,friends
i told him about how i was feeling helpless about my health and he shuffled the cards,0,0,0,0,0,0,0,0,0,0,1,0,0,health
i feel horrible because i was supposed to meet a friend there but she forgave me for not showing up,0,0,0,0,0,0,0,0,0,0,1,0,0,friends
i love the feeling of being at the end of the world where all of the petty stuff doesnt matter anymore,0,1,0,0,0,0,0,0,0,0,0,0,0,love
i felt so bad for the bad grade and feeling like having to hide it that i didnt know what to say except to declare in all my frustration that i hated school,0,1,0,0,0,0,0,0,0,0,0,0,0,school
i have only been back to work days today is the third and i am already feeling stressed,0,0,0,0,0,0,0,0,0,0,1,0,0,work
i think my peace with it all was a surprise to my mother and sister who witnessed me holding bonkers and asked afterwards how i was feeling and probably relieved that i was not resentful or sad,0,0,0,0,0,0,0,0,1,0,0,0,0,family
i don t feel valued i am not motivated to work hard,0,0,0,0,0,0,0,0,1,0,0,0,0,work
im feeling less anxious about things i passed my background check for the job and so now i just gotta find myself a desk that will fit two monitors and just wait to start training,1,0,0,0,0,0,0,0,0,0,0,0,0,work
i ended up sleeping until and i still didn t feel perfect,0,0,0,0,0,0,0,0,1,0,0,0,0,sleep
i feel grumpy today because i am the cleaning lady,0,1,0,0,0,0,0,0,0,0,0,0,0,work
