text,afraid,angry,anxious,calm,confused,disgusted,excited,frustrated,happy,proud,sad,satisfied,surprised,topic
"My family was the most salient part of my day, since most days the care of my 2 children occupies the majority of my time. They are 2 years old and 7 months and I love them, but they also require so much attention that my anxiety is higher than ever. I am often overwhelmed by the care the require, but at the same, I am so excited to see them hit developmental and social milestones.",0,0,1,0,0,0,0,0,1,1,0,0,0,family
Yoga keeps me focused. I am able to take some time for me and breath and work my body. This is important because it sets up my mood for the whole day.,0,0,0,1,0,0,0,0,0,0,0,0,0,exercise
"Yesterday, my family and I played a bunch of board games. My husband won most of them which is not surprising in the least. We played all sorts of games including Life, Clue, Mouse Trap and more. It was relaxing and such a happy, fun filled moment.",0,0,0,1,0,0,0,0,1,0,0,1,0,family
"Yesterday, I visited my parents and had dinner with them.  I hadn't seen them in a few weeks, so it was wonderful to see them and catch up on things.",0,0,0,1,0,0,0,0,1,0,0,0,0,family
"Yesterday, I really felt the importance of my health. I went on a bit longer hike than usual and was very happy that I could do so. It really made me appreciate my health. With all the news of people dying and the tragedy of the Utah family murder in Mexico, it really made me aware of the importance of my own health and well being.",0,0,0,0,0,0,0,0,1,0,0,0,0,health
"Yesterday, I had to go to work. It was my first day back to work after my weekend, so I was pretty frustrated and sad. It was a pretty boring day overall.",0,1,1,0,0,0,0,1,0,0,1,0,0,work
"Yesterday, I got a lot of things ready for listing, and fielded many questions from potential buyers. I also did some surveys on Mturk. Woke up this morning to find that there are quite a few items that now have bids and will sell today and tomorrow, and also had 2 bonuses from surveys.",0,0,1,0,0,0,0,0,0,1,0,1,0,work
"Yesterday, I finished two of the requirements for the semester. I felt relieved because the requirements were hindering me from writing my MA thesis. I also felt proud because I was able to do the tasks with flying colors.",0,0,0,0,0,0,0,0,0,1,0,1,0,school
yesterday work was like the good old days. There was so much to do and I barely had time to think. I like being busy and overwhlemed and work has been terribly boring and slow lately. Yesterday was a good day.,0,0,0,0,0,0,0,0,1,1,0,0,0,work
Yesterday was the sixth of the month so I read the sixth chapter of Proverbs.  The wisdom gift that God gave to Solomon is passed on to me through this writing.  I felt a great connection over the centuries to God's intervention in this man's life.,0,0,0,0,0,0,0,0,1,0,0,0,0,god
"Yesterday was my husband's birthday, and since we'd done the whole revelry thing the day before we spent it peacefully in bed watching pointless TV shows.",0,0,0,0,0,0,0,0,1,0,0,0,0,love
yesterday was my daughters first birthday and it was such a happy event! we opened her presents and gave her a giant cupcake to eat all to herself. Me and my family had a blast celebrating this milestone in my daughters life.,0,0,0,0,0,0,0,0,1,0,0,0,0,family
Yesterday was my birthday and I spent it with my family which is the most important thing in my life. I felt loved and pampered as if I was the most important thing in their lives as well,0,0,0,0,0,0,0,0,1,1,0,0,0,family
"Yesterday was my ""PULL DAY"" in my workout routine. I was able to achieve 50 pull ups with 65 lbs hanging from my waist on my dip belt. I went up in weight from last week and felt great!",0,0,0,0,0,0,1,0,1,0,0,1,0,exercise
"Yesterday was a very productive day at work for me. I finished all of my work for my real-world job very quickly, and was able to also make over $100 on Mechanical Turk, which will help tremendously with getting out from under some past due bills currently weighing on me.",0,0,0,0,0,0,1,0,1,1,0,0,0,work
Yesterday was a very informative day with my son and daughter-in-law. My son told me he was starting a new semester at school and he would be enrolling on his day off Friday. My daughter-in-law was very happy yesterday and offered to bring me newspapers from work which she could get free from her boss. All in all a very pleasant day.,0,0,0,0,0,0,0,0,0,1,0,0,0,family
"Yesterday was a great day at work! My client was great with expressing his desire to gain my attention. I taught him yesterday how to say ""hi"" to gain attention of adults and by the end of the day, he was saying ""hi"" to every adult that passed through the clinic!",0,0,0,1,0,0,0,0,1,0,0,1,0,work
"Yesterday was a bad day for diverticular disease, I couldn't eat, and I was in a lot of pain. Still, I was able to function through it, and I know that if I'm patient the pain will go away eventually. I just wish there was a more permanent solution.",0,1,0,0,0,0,0,1,0,0,1,0,0,health
Yesterday there was enough turk work for a change. It has been very slow recently. At least I have a chance of meeting my bill payments next week but I have to sit on the computer every possible second to grab possible work.,0,0,1,0,0,0,0,0,0,0,0,1,0,work
Yesterday my wife and I found out that our infertility treatment will be covered by insurance.,0,0,0,0,0,0,0,0,1,0,0,0,0,love
Yesterday my oldest daughter had her first high school weight lifting meet of the season.  This event was the result of many of many hours of hard work.  She did very well coming in second place in her weight class.,0,0,0,0,0,0,1,0,1,1,0,0,0,family
"Yesterday my children and grand children came over for a cook out. I had not seem them all together for a few weeks so it was great to get them all together. I have a son, daughter and three grandchildren, two boys and a girl.",0,0,0,0,0,0,0,0,1,0,0,0,0,family
"Yesterday I worked out for a good hour or so. I'm really trying to lose weight so working out is becoming the most important part of my day. It was hard, and at times I became really frustrated. In the end I was happy I did it, it just wasn't enjoyable while I was in the process of working out.",0,0,0,0,0,0,0,1,0,0,0,0,0,exercise
Yesterday I worked online most of the day. I discovered an assignment I had done the previous day was rejected. This assignment provided a considerable reward so I basically lost about an hour's worth of work. That was frustrating. We need the money I am making onine right now to pay our bills so I was also concerned about making enough money. However at the end of the day I hit my earnings goal so I was satisfied with my progress.,0,0,0,0,0,0,0,1,0,0,0,1,0,work
Yesterday I worked on a way for my family to see my private photos on Flickr without registering on the site. I found out that anonymous guests can see the photos but they can't comment. And the comments are the main reason for the photo-sharing! Very frustrating.,0,0,0,0,1,0,0,1,0,0,0,0,1,recreation
"Yesterday I went to my GP to get informed of a cat scan of my hip, which has been bothering me (I'm 73). I was happy to find out that it isn't arthritis, though there is a little in the hip, but a pinched nerve. I was given some exercises I can do to help alleviate my pain. I felt good that it isn't necessarily a degenerative thing.",0,0,0,0,0,0,0,0,1,0,0,1,0,health
"Yesterday I went to exercise at the gym. I did weight lifting, mainly worked out on bench press. I felt satisfied because I was able to PR on a set.",0,0,0,0,0,0,0,0,1,0,0,1,0,exercise
"Yesterday I went hunting. I had to hike for 4 miles and I was able to stalk a large deer for quite a while. I didn't get anything, but I had a really good time and felt great when I got home.",0,0,0,0,0,0,1,0,1,0,0,1,0,recreation
Yesterday I went for a walk with a friend. About a mile into our walk it starting pouring down rain. We were soaked before we made it back to the car.,0,0,0,0,0,0,0,1,0,0,0,0,0,exercise
"Yesterday I was sick with a stomach bug. I spent all day in bed and barely eating, and it was overall a pretty miserable day.",0,0,0,0,0,1,0,0,0,0,0,0,0,health
Yesterday I was reminded of how loved and appreciated I am. I was reminded that the people I care about care about me as well and that I am important to them,0,0,0,0,0,0,1,0,1,0,0,1,0,family
"Yesterday I was diagnosed with cancer. I don't know how to feel, right now I just feel empty and possibly in shock. I haven't told anyone yet, but I think I will probably call my parents and sisters today to let them know. I just need time to process this alone right now.",0,0,0,0,1,0,0,0,0,0,1,0,0,health
Yesterday I stopped by Subway while my clothes were in the dryer at the laundromat. I ordered a six inch tuna melt with spinach tomato jalapeno and pickles. It was one of the greatest tasting sandwiches I have had in a long time and it was healthy eating.,0,0,0,0,0,0,0,0,1,0,0,0,0,food
"Yesterday I made a lot more money on Mturk then I expected, a whole $23!  These last few weeks have been pretty rough, not many HITS are out, probably because almost the holidays",0,0,0,0,0,0,1,0,1,0,0,0,0,work
Yesterday I left work and met my family at Target. We had to return some baby pajamas and get different ones. I was just happy to get out of work and spend time with my family. Afterw\ard we went to eat then home and watched a movie. It was a relaxing evening.,0,0,0,0,0,0,0,0,1,1,0,1,0,family
"Yesterday I had to go to the dentist and was worried about my oral health. You see, 3 months ago, when I went for my teeth cleaning, the checkup was not so good so I was worried it might be even worse, so I was anxious heading into the appoointment.",0,0,1,0,0,0,0,0,0,0,0,0,0,health
"Yesterday I did some research about getting my calendars printed out-- what they will cost, different methods. I think this project is really going to be doable.",0,0,0,0,0,0,1,0,1,1,0,0,0,work
Yesterday I completed 16 surveys. I was satisfied with work.,0,0,0,0,0,0,0,0,0,0,0,1,0,work
Yesterday despite feeling sluggish,0,0,0,0,0,0,0,0,1,1,0,1,0,exercise
"Working for slave wages and getting screwed and exploied every day, seven days a week, is driving me nuts.  I hate it.  Why can there be any decent requestors who pay a living wage?",0,1,1,0,0,0,0,1,0,0,0,0,0,work
Working being able to use my skills and knowledge for the benefit and growth of our company.,0,0,0,0,0,0,0,0,0,1,0,0,0,work
"Work was very demanindg yesteday it required me to work extyra long in order to finish the project that was under way when I started the week. We as a team were on a tight deadline and in  order to finish we were really all working hard. It was amazing, interesting and so much fun I havent had htis much fun at work ever.",0,0,0,1,0,0,1,0,1,0,0,0,0,work
"Work was long today. I did a lot of different projects at 2 different stores. It was frustrating some of the time, but the fact that I finished everything gave me a sense of accomplishment.",0,0,0,0,0,0,0,1,0,0,0,1,0,work
Work made me feel like I had a purpose but also frustrated and annoyed because there are so many things going on at once.,0,0,1,0,0,0,0,1,0,1,0,0,0,work
Work is salient because doing it allows me to earn money so I can pay bills and not starve to death. I felt satisfied with the amount of work I was able to put in to my work project yesterday.,0,0,0,0,0,0,0,0,0,0,0,1,0,work
Work is rather salient because I spend the majority of my day there. Nothing particularly exciting or interesting really happened there but it was fairly busy as it usually is. Given that we're federal employees who are excepted from the furlough but not being paid to work we spent a lot of our day talking about the shut down and what if anything Trump is doing to attempt to alleviate it.,0,1,1,0,0,0,0,0,0,0,0,0,0,work
"Work is probably the most important and salient thing I do. It's not very exciting and can be very frustrating, but it provides me with an income to pursue other things I care about more. However, since it was just a Wednesday, I didn't really have anything else going on.",0,0,0,0,0,0,0,1,0,0,0,0,0,work
"Work is important, I like to be busy and have a purpose.  It makes me feel good to have alot to do and important responsibilities.  It boosts my self esteem and makes me feel good.",0,0,0,1,0,0,0,0,1,0,0,1,0,work
Work dominated my day yesterday. There was a mountain of work so I was somewhat frustrated that many things had to be disregarded in my personal life to finish work.,0,0,0,0,0,0,0,1,0,0,0,0,0,work
when nothing goes right I know God is there with me. He is there to lift me up. he's always there to talk to and never judges me. I love him and always blessed for the blessing he gives,0,0,0,1,0,0,0,0,1,0,0,1,0,god
"What was most salient about my day yesterday, was spending quality time with my children. Together, we raked the leaves outside in the yard and shared laughter and joy.",0,0,0,0,0,0,0,0,0,0,0,1,0,family
Went to visit my mom in the hospital she was just transferred from the ICU to a regular ward and she was alert and talking which was a huge change from a few days ago,0,0,1,0,0,0,0,0,0,0,0,0,1,health
Went grocery shopping with my mom. Got a flu shot while I was there.,0,0,0,0,0,0,0,0,1,0,0,1,0,family
we had such a good time it was nice and felt very nice he was very loving,0,0,0,0,0,0,0,0,1,0,0,0,0,love
We had friends surprise us with a visit. We haven't seen them over 2 years. We were all so excited! They are from Hawaii and it is snowing here so we got to play in the snow with them and build a snowman!,0,0,0,1,0,0,1,0,1,1,0,1,0,friends
"we had a pretty big extracation that i performed well on.  i carried out my duties pretty well, and was self directed at all of it. I felt proud of myself for functioning like I've been there and done that before.",0,0,1,0,0,0,1,0,0,1,0,0,0,work
was able to meet up with my girlfriend after a week of not seeing her. I was very excited.,0,0,0,0,0,0,1,0,0,0,0,0,0,love
Was able to eat some of my favorite food so i was pretty happy and excited and couldnt wait to eat it.,0,0,1,0,0,0,1,0,0,0,0,0,0,food
Waking up rereshed and having a great conversation with my wife.  We talked all day and it never ceased to be insightful and amazing,0,0,0,0,0,0,0,0,1,0,0,1,0,family
"Upon picking up my only child from school, she gave me the amazing news, she was chosen to be in Honors quiet. Dad and I are so happy and proud of her. We dont know how we are going to squeeze in Choir rehearsals with her ballet rehearsals but we will figure it out. Dad and i are taking sunday off, so we can go and celebrate her invitation. We are so busy with life, that we need to start to take and make time for each other. i find it curious that this survey came up, when my first thought this morning was, how bless i am to have my family, how quickly time is passing, and how to make time for each other.",0,0,0,0,0,0,1,0,1,1,0,1,0,family
"Trying to help my mother-in-law find a home, but it's kind of awkward because I feep like she wants to live with us.",0,0,0,0,1,0,1,0,1,0,0,0,0,family
"Today, I exercised and it honestly felt amazing.  The feeling after a good workout is hard to beat.",0,0,0,0,0,0,1,0,1,1,0,1,0,exercise
Today we had my favorite food in the whole world for dinner!  Pepperoni pizza from Angelo's Pizza Parlour.  It always makes my day when we have pizza!,0,0,0,1,0,0,0,0,0,0,0,1,0,food
Today we had a snow day or shall I be more specific; we had an ice day!  There was a layer of slick ice that coated all outdoor surfaces so my children were home from school.  We induldged in the day and enjoyed eachothers company by playing games and making cookings.  We watched a chinese anime movie before dinner and snuggled on the couch.,0,0,0,0,0,0,0,0,1,1,0,1,0,family
Today was my best earning day today. If I can keep earning like this I can save money for the cruise with my friends.,0,0,0,0,0,0,0,0,1,1,0,1,0,work
today was just a normal day. I worked all day and nothing really happened. During slack times I worked on Mturk. It felt like another day,0,0,0,0,0,0,0,0,0,0,0,1,0,work
"Today was a very busy day at work.  We had corporate visitors and had to be on our best behavior.  I also had to make a prewsentation about my section to the corporate people.  It went well, and I glad to be done with it.",0,0,0,1,0,0,0,0,0,0,0,0,0,work
Today was a blessed day as I had God in my heart! It was a good day as it was a day of appreciation for everything I have in this life!,0,0,0,0,0,0,0,0,1,0,0,0,0,god
Today is a memorable day. Ananya performed a hul hoop dance in her school talent show her first ever performance outside home in all of her seven years.,0,0,0,0,0,0,0,0,0,0,0,1,0,family
Today I went out to drink with friends. We decided to have unlimited wings contest. Between the 4 of us i came in second. I performed better than last time coming in last. It was a great time. We drank talked and ate.,0,0,0,0,0,0,0,0,1,0,0,1,1,family
Today I was very sick. It seems everybody I know has a cold and I thought I was above it but no. I had some orange juice and went back to bed. Not a good day.,0,0,0,0,0,1,0,1,0,0,1,0,0,health
Today I was able to make $18 on mturk. New record for a day. It took from 6AM till about 8PM. Once I got to $15 I kept going to see how much I could make but the hits dried up.,0,0,0,0,0,0,0,0,1,0,0,1,1,work
Today I spent time with a student at work who is volunteering at the hospital.  She is working on her MSW and we discussed her graduations project.,0,0,0,0,0,0,0,0,0,0,0,1,0,work
Today I had a good and easy day. Everything in the department was taken care of and no new issues came up.,0,0,0,1,0,0,0,0,0,1,0,0,0,work
Today I feel sad at work. I feel anxious because I have too much to do. I feel so overwhelmed,0,0,1,0,0,0,0,0,0,0,1,0,0,work
"Today at work I had the chance to catalog a $40k book which was a prized possession of my boss. It was just about falling apart but I was able to flip through, translate some German and get it up online for sale. My boss was pleased.",0,0,0,0,0,0,0,0,0,1,0,0,0,work
Time spend with my family is always better than anything,0,0,0,1,0,0,0,0,0,0,0,0,0,family
This would be kayaking with my dog.  There is nothing more peaceful than taking the boat out on the water with my best pal and just enjoying the peace and tranquility of the water and the breeze.  It make a horrible day at work just melt away.,0,0,0,1,0,0,0,0,1,0,0,1,0,recreation
This week has been going great. I've established good relationships with all my friends and I feel like I'm at a place where I feel loved and supported by everyone who I know. I'm hanging out with people more and it just makes me happy that a lot of people want to hang out with me to. It's always a fun time to go out and get food which is something that I do a lot.,0,0,0,0,0,0,1,0,1,0,0,1,0,friends
"There was an incident with my spouse where he was trying to restrain our dog that recently had surgery when we were going to feed him. Unfortunately, the dog reared his head back and hit my spouse in the mouth and knocked out his dental crown. This situation surprised me and made me anxious/frustrated because my spouse was really upset and now we'd have additional expenses to fix his dental work.",0,0,1,0,0,0,0,1,0,0,0,0,1,family
The work yesterday was different than most of days. I had some issues and the deadline was approaching. I almost missed it. Luckily I have the best co-workers that helped me out before I have asked for any help.,0,0,0,1,0,0,0,0,0,0,0,1,1,work
The salient thing i did yesterday was spending time with family. My husband was at home yesterday for two days then he will work again for 5 days. So we always make sure we spend quality time together as a family when he is at home.,0,0,0,0,0,0,1,0,1,0,0,1,0,family
The night before last i.e. yesterday morning I slept for over 10 hours straight which is not normally a thing I ever do like ever. Unfortunately I felt like absolute crap as the result of having caught something most likely the flu so I did not feel great at all in fact I felt like total crap. Cough crap in my throat crap in my lungs the whole bit. I was a bit worried I was going to wake up feeling way sicker but that didn't stop the fact that I absolutely needed to crash at like 8 PM. So I did. Woke up feeling sooo much more refreshed. Still sick but not nearly as bad. 10 hours of sleep was what I needed I guess. Still sick though.,1,0,1,0,0,0,0,0,0,0,0,1,0,sleep
"The most salient thing yesterday was relationship to my family. I talked to my daughter in the morning, to my son in the afternoon, and spent all day with my wife. I had a very enjoyable wonderful day.",0,0,0,0,0,0,0,0,1,0,0,1,0,family
The most salient thing I felt yesterday was loving life. I for the most part feel blessed in all that I have accomplished in life and am very grateful,0,0,0,0,0,0,0,0,1,0,0,0,0,love
The most salient thing from yesterday was my 8-mile hike. I had the day off work so I decided to hit the hiking trails in my town. I spent a few hours hiking 8 miles in the Ozark Mountains. The day was warm and beautiful. Feeling the sun on my back felt good.,0,0,0,0,0,0,1,0,1,0,0,1,0,recreation
"The most salient thing from yesterday was how we are a family (wife and 3 kids) but as of recent we have been very distant from each other so the household is cold and callous. Just last month our house was loud and boisterous, now its silent and uncomfortable.",0,0,0,0,0,0,0,0,0,0,1,0,0,family
"The most salient thing about my day yesterday was recreation, or maybe I should say, the lack thereof. I was so distracted and bored yesterday, I couldn't find anything to keep myself occupied with all day long. I was antsy most of the day and it was entirely frustrating. I tried to talk to a few friends about it, maybe make some plans to do something, but they were all otherwise engaged for the day, which made it even more frustrating. I really need to calm my mind so I can focus on something, get immersed in it. That'll help the anxiety and the boredom.",0,0,1,0,0,0,0,1,0,0,0,0,0,recreation
"The most noticeable and important thing in my life yesterday was the reconciliation with my ex-partner. We officially became a couple and spent a lot of time together becoming closer, and sharing our thoughts and ideas, and taking care of one another. I felt happy and hopeful that this time everything would work out for the best.",0,0,0,0,0,0,0,0,1,0,0,1,0,love
The most important thing in my life is always God or my salvation. It makes me feel calm or at peace knowing no matter what life throws at me he is on the throne fighting my battles for me and I am going to be okay,0,0,0,1,0,0,0,0,0,0,0,0,0,god
THE MARKETING TEAM MET TO REVIEW AND REVISE OUR MARKETING PROGRAM FOR THE COMPANY. THE PROGRESS WE MADE WAS EXCLENT AND I AM PROUD BEING THE LEADER OF THIS TEAM.,0,0,0,0,0,0,1,0,0,1,0,1,0,work
The kids had a half day at school and went for a hang out at different friend's homes.  I picked them up after work and both friends are from affluent families - we are not and the process of entering large mansions and speaking with the other parents makes me a bit anxious.,0,0,1,0,0,0,0,0,0,0,0,0,0,family
The food was wonderful.  it was Chinese food from the local restaurant.  i had chicken teriaki french fries and sauteed brocolli in a lovely sauce.  the meat was sp juicy and moist.  the fries were to golden perfection and the sauce on the brocolli was outstanding.  i was so satisfied and sated afterward.  it made my day complete.,0,0,0,0,0,0,1,0,1,0,0,1,0,food
the food I made was good and made me happy and enjoy my day,0,0,0,0,0,0,1,0,1,1,0,0,0,food
The day was great and I wish it would never end.  Life couldn't be any better.,0,0,0,1,0,0,0,0,1,0,0,0,0,friends
The answers in the Bible are God speaking to me which gives me directioncomfort joyhappinesspeace goodnessgentlenessmeeknesstemperance,0,0,0,0,0,0,1,0,0,0,0,0,0,god
That small things dont matter. That you should be thankful for the person that loves you and that you love.,1,0,0,0,0,0,0,0,1,0,0,0,0,family
Taking care of my family especially my kids is the most important responsibility I do. It brings me joy and happiness being able to spend time with my family.,0,0,0,0,0,0,0,0,1,0,0,1,0,family
Spending time with my wife after work is most precious event of the day. Making our dinner together and catching up on things with my wife during cooking a meal is precious and fun way to spend time together.,0,0,0,0,0,0,0,0,1,0,0,0,0,love
Spending time with my family meaning my spouse and children gives me so much joy. Being older and having young chilldren gives me an appreciation of every moment with them. It has also given me a real focus on what is important. I never want to be a disappointment to them but instead be an example.,0,0,0,0,0,0,0,0,1,0,0,0,0,family
"Spending time with my family makes me happy, I am so grateful for them. I feel lucky to have been so blessed.",0,0,0,0,0,0,0,0,1,1,0,1,0,family
spending time with my family is what I do everyday. its something that makes me really happy,0,0,0,0,0,0,0,0,1,1,0,1,0,family
Spending time with my daughter and my husband was the most salient thing I did yesterday.  I was out of town for the weekend and was very excited to have some time to catch up with them and just hang out and relax together.,0,0,0,1,0,0,0,0,1,0,0,1,0,family
"So I helped my Aunt move some things out of my friends house on quite short notice, and the overall sense I had after the task was done was that I felt very reliable. I was pleased that I could be so useful and reliable as a source of free labor, and that I was willing to help a stranger with no questions asked.",0,0,0,0,0,0,0,0,0,1,0,1,0,family
